elevator,rooms,address,price,size
 con ascensore,3 ,"Trilocale in via giuseppe meda, s.n.c, Cermenate-Meda, Milano",1.050,70 
 con ascensore,2 ,"Bilocale in via gargano, 57, Val di Sole-Fatima, Milano",950,75 
 senza ascensore,2 ,"Bilocale in via cesare battisti, 33, Cologno Monzese",500,50 
 senza ascensore,,"Monolocale in via benedetto croce, s.n.c, Cologno Monzese",500,50 
 con ascensore,,"Monolocale in via giuseppe di vittorio, 235, Dei Parchi-Cascina Gatti-Parpagliona, Sesto San Giovanni",450,40 
 con ascensore,2 ,"Bilocale in via emilia, 58, Cologno Monzese",600,60 
 senza ascensore,2 ,"Attico in via marostica, 29, Bande Nere, Milano",900,55 
 con ascensore,3 ,"Trilocale in via Marchionni, 31, Comasina-Bruzzano, Milano",900,90 
,2 ,"Bilocale in via giuseppe candiani, s.n.c, Bovisa, Milano",790,55 
 ,2 ,"Bilocale in Bligny-Toscana, Milano",1.200,75 
 con ascensore,2 ,"Bilocale in via Tortona, 18, Solari-Savona-Tortona, Milano",800,45 
 senza ascensore,2 ,"Bilocale in via solferino, s.n.c, Moscova-Repubblica, Milano",1.875,75 
,2 ,"Bilocale in Teodosio-Porpora, Milano",700,50 
 con ascensore,3 ,"Trilocale in via monte nero, Cinque Giornate-Montenero-Libia, Milano",1.200,80 
,3 ,"Trilocale in via francesco olgiati, Naviglio Grande-Barona, Milano",1.300,120 
,,"Monolocale in via bovisasca, Bovisa, Milano",750,15 
,2 ,"Bilocale in via domenico veneziano, Sulmona, Milano",750,25 
,,"Monolocale in via per imbersago, Cologno Monzese",450,40 
,4 ,"Quadrilocale in via guzzina, Cologno Monzese",780,130 
 senza ascensore,2 ,"Bilocale in via figino, s.n.c, Pero",750,60 
 con ascensore,6 ,"Appartamento in via gaetano donizetti, Palestro, Milano",3.750,260 
 con ascensore,9 ,"Appartamento in via lodovico ariosto, Ariosto-Magenta, Milano",5.833,358 
 con ascensore,3 ,"Trilocale in piazza de angeli ernesto, San Vittore-Washington, Milano",2.000,92 
,4 ,"Quadrilocale in foro buonaparte, Duomo-Castello, Milano",3.500,180 
 con ascensore,2 ,"Bilocale in piazza trento e trieste, Cusano Milanino",450,58 
 con ascensore,5 ,"Appartamento in via gustavo modena, Indipendenza-Regina Giovanna, Milano",2.000,132 
 senza ascensore,,"Monolocale in largo crocetta, Mercalli-Quadronno, Milano",850,40 
 con ascensore,2 ,"Bilocale in via negroli, 44, Argonne-Corsica, Milano",840,65 
,2 ,"Bilocale in via flumendosa, Crescenzago, Milano",900,25 
,2 ,"Bilocale in via carolina invernizio, Quarto Oggiaro-Euromilano, Milano",750,25 
,2 ,"Bilocale in via vincenzo lancetti, Dergano, Milano",1.100,25 
,2 ,"Bilocale in via marco polo, Corsico",950,25 
,,"Monolocale in via pastrengo, Garibaldi-Isola, Milano",1.600,15 
,3 ,"Trilocale in via dello sport, Gorgonzola",1.200,75 
,2 ,"Bilocale in via arcangelo corelli, Parco Forlanini, Milano",700,50 
,,"Monolocale in via bligny, Bligny-Toscana, Milano",2.500,15 
,2 ,"Bilocale in via privata degli orombelli, Città Studi, Milano",1.200,35 
,,"Monolocale in via euclide, Precotto, Milano",800,38 
,,"Monolocale in corso di porta romana, Tribunale, Milano",1.800,15 
,2 ,"Bilocale in via francesco predabissi, Teodosio-Porpora, Milano",1.100,35 
,2 ,"Bilocale in via dei missaglia, Chiesa Rossa, Milano",1.050,25 
,,"Monolocale in via biringhello, Passirana-Biringhello, Rho",500,15 
,2 ,"Bilocale in via andrea mantegna, Sempione, Milano",1.600,25 
,2 ,"Bilocale in via savona, Lorenteggio-Giambellino, Milano",1.100,25 
,2 ,"Bilocale in via gian battista vico, San Vittore-Washington, Milano",1.445,25 
,2 ,"Bilocale in via ungheria, Rogoredo-Santa Giulia, Milano",700,25 
,2 ,"Bilocale in via carlo pisacane, Indipendenza-Regina Giovanna, Milano",2.200,25 
,2 ,"Bilocale in via polibio, San Vittore-Washington, Milano",1.900,25 
,,"Monolocale in via romilli arcivescovo, Ortles, Milano",800,15 
 con ascensore,,"Monolocale in via antonio stoppani, Abruzzi, Milano",700,25 
,2 ,"Bilocale in via gian battista vico, San Vittore-Washington, Milano",1.445,25 
,2 ,"Bilocale in via ungheria, Rogoredo-Santa Giulia, Milano",700,25 
,2 ,"Bilocale in via carlo pisacane, Indipendenza-Regina Giovanna, Milano",2.200,25 
,2 ,"Bilocale in via polibio, San Vittore-Washington, Milano",1.900,25 
,,"Monolocale in via romilli arcivescovo, Ortles, Milano",800,15 
 con ascensore,,"Monolocale in via antonio stoppani, Abruzzi, Milano",700,25 
 con ascensore,3 ,"Trilocale in piazza adigrat, 6, Argonne-Corsica, Milano",1.500,120 
 con ascensore,3 ,"Trilocale in via massimo d'azeglio, 29, Rozzano",700,105 
 senza ascensore,4 ,"Quadrilocale in piazzale dateo, Indipendenza-Regina Giovanna, Milano",1.500,120 
,3 ,"Trilocale in via pietro verri, San Magno-Sant'Ambrogio, Legnano",600,95 
 con ascensore,2 ,"Bilocale in via carlo porta, Basiglio",800,67 
 con ascensore,2 ,"Bilocale in via eugenio camerini, Teodosio-Porpora, Milano",680,45 
,,"Monolocale in via verbano, 22, Abbiategrasso",550,45 
 con ascensore,2 ,"Bilocale in via fra giovanni pantaleo, s.n.c, Bovisa, Milano",600,50 
,,"Monolocale in via bessarione, 46, Corvetto, Milano",550,30 
 con ascensore,3 ,"Trilocale in via Don Rodrigo, 6, Chiesa Rossa, Milano",1.000,65 
 con ascensore,2 ,"Bilocale in San Vittore-Washington, Milano",950,73 
 con ascensore,2 ,"Bilocale in via del castagno,, Sulmona, Milano",850,70 
 con ascensore,,"Monolocale in via ungheria, 20, Rogoredo-Santa Giulia, Milano",550,45 
 senza ascensore,3 ,"Trilocale in via carlo pisacane, 11, Pero",800,80 
 ,3 ,"Trilocale in via privata degli orombelli, Città Studi, Milano",1.080,70 
,2 ,Bilocale a Pioltello,550,50 
 con ascensore,2 ,"Bilocale in via ettore troilo, Navigli-Porta Genova, Milano",830,55 
 con ascensore,3 ,"Trilocale in via lampugnano, Gallaratese, Milano",1.100,110 
 con ascensore,3 ,"Trilocale in piazza tirana, Lorenteggio-Giambellino, Milano",600,75 
 ,3 ,"Trilocale in via privata simone schiaffino, Bovisa, Milano",900,85 
 con ascensore,2 ,"Bilocale in via della libertà, 74, San Donato Milanese",680,65 
 con ascensore,2 ,"Bilocale in via martiri delle foibe, 21, Pelucca-Villaggio Falck, Sesto San Giovanni",720,65 
 senza ascensore,2 ,"Bilocale in via xi febbraio, 3, San Giuliano Milanese",600,60 
 ,3 ,"Trilocale in via privata simone schiaffino, Bovisa, Milano",800,80 
 senza ascensore,3 ,"Appartamento su due piani in via cola montano, 12, Garibaldi-Isola, Milano",1.500,80 
 senza ascensore,2 ,"Bilocale in corte palazzo 3, Vernate",650,60 
 con ascensore,6 ,"Appartamento in Duomo-Castello, Milano",3.400,260 
 con ascensore,3 ,"Trilocale in via asiago, s.n.c, Gorla, Milano",677,100 
 con ascensore,,"Monolocale in via freiköfel, s.n.c, Rogoredo-Santa Giulia, Milano",384,35 
 con ascensore,2 ,"Bilocale in via rogoredo, s.n.c, Rogoredo-Santa Giulia, Milano",534,65 
 con ascensore,2 ,"Bilocale in via alfonso lamarmora, Tribunale, Milano",1.350,63 
 con ascensore,2 ,"Bilocale in via don giuseppe del corno, Crescenzago, Milano",900,55 
 con ascensore,3 ,"Trilocale in via vittoria colonna, Fiera, Milano",1.833,100 
 con ascensore,3 ,"Trilocale in via giulio e corrado venini, Brianza-Pasteur, Milano",1.417,95 
 con ascensore,3 ,"Trilocale in via giulio cesare procaccini, Sempione, Milano",1.583,95 
 con ascensore,4 ,"Quadrilocale in piazza esquilino, 9, San Siro, Milano",1.800,170 
 con ascensore,2 ,"Bilocale in via andrea costa, s.n.c, Teodosio-Porpora, Milano",1.000,75 
,,"Appartamento su due piani in via corsica, 95, Argonne-Corsica, Milano",1.500,110 
 con ascensore,2 ,"Bilocale in via del castagno, 2, Sulmona, Milano",800,70 
 con ascensore,4 ,"Quadrilocale in via arrigo boito, Duomo-Castello, Milano",2.750,170 
 con ascensore,5 ,"Appartamento in via privata maria teresa, s.n.c, Zona Sant`Ambrogio-Università Cattolica, Milano",4.083,166 
 con ascensore,4 ,"Appartamento su due piani in Fiori Chiari, 5, Brera-Montenapoleone, Milano",1.950,105 
 con ascensore,2 ,"Bilocale in via Chiasserini Dante, 11, Bovisasca, Milano",650,55 
,2 ,"Bilocale in via Don Tazzoli, Parabiago",550,70 
,,"Monolocale in Magenta 16, Melzo",450,40 
 con ascensore,4 ,"Quadrilocale in via ippolito nievo, Portello-Tre Torri, Milano",2.500,154 
 con ascensore,5 ,"Appartamento in viale Andrea Doria, 57, Centrale, Milano",3.200,150 
 con ascensore,2 ,"Bilocale in via G. Leopardi, 10, Pregnana Milanese",650,69 
 con ascensore,2 ,"Bilocale in via Avancini Avancinio, 4, Chiesa Rossa, Milano",1.000,50 
 con ascensore,,"Monolocale in via Avancini Avancinio, 4, Chiesa Rossa, Milano",810,40 
 con ascensore,2 ,"Bilocale in via Avancinio Avancini, 4, Chiesa Rossa, Milano",1.000,50 
 senza ascensore,4 ,"Quadrilocale in via Gemona, 5, Castano Primo",600,100 
,2 ,Bilocale a Cambiago,400,40 
 con ascensore,3 ,Trilocale a Carugate,730,90 
 con ascensore,3 ,"Trilocale in Morgantini, Milano",1.300,125 
 con ascensore,2 ,"Bilocale in Lorenteggio-Giambellino, Milano",800,70 
,2 ,"Bilocale in via mameli, 8, Cisliano",530,60 
,2 ,Bilocale a Peschiera Borromeo,460,50 
,2 ,Bilocale a Bollate,530,55 
 con ascensore,2 ,"Bilocale in alzaia naviglio pavese, Navigli-Porta Genova, Milano",900,60 
 ,2 ,"Bilocale in Mercalli-Quadronno, Milano",1.300,75 
 senza ascensore,2 ,"Bilocale in via dei fontanili, 2, Vigentino, Milano",1.200,60 
,,Monolocale a Locate Triulzi,550,55 
 con ascensore,4 ,"Quadrilocale in Lorenteggio-Giambellino, Milano",1.100,130 
 con ascensore,3 ,"Trilocale in via ciro menotti, s.n.c, La Flora-Parco Alto Milanese, Legnano",650,100 
,2 ,Bilocale a Cuggiono,500,70 
 con ascensore,2 ,"Bilocale in via fosse ardeatine, s.n.c, Senago",700,80 
 senza ascensore,2 ,"Bilocale in via giacomo watt, 18, Naviglio Grande-Barona, Milano",650,55 
 con ascensore,2 ,"Bilocale in via lodovico muratori, 54, Cinque Giornate-Montenero-Libia, Milano",1.050,60 
 senza ascensore,,"Monolocale in via monza, 83, Brianza-Pasteur, Milano",600,30 
 con ascensore,2 ,"Bilocale in via cerva, 14, Vittorio Emanuele-Augusto, Milano",2.200,105 
 senza ascensore,2 ,"Bilocale in via ettore paladini, 15, Argonne-Corsica, Milano",600,60 
 con ascensore,,"Monolocale in via leonardo da vinci, 5, Paullo",420,45 
 con ascensore,,"Monolocale in via teodosio, 82, Teodosio-Porpora, Milano",820,40 
,2 ,"Bilocale in piazza monte falterona, 13, Morgantini, Milano",850,55 
 con ascensore,4 ,"Quadrilocale in via pellegrino rossi, 13, Affori, Milano",1.200,140 
 senza ascensore,3 ,"Trilocale in via pistrucci scipione, 11, Martini-Cuoco, Milano",1.100,75 
 con ascensore,4 ,"Quadrilocale in via innocenzo isimbardi, 29, Chiesa Rossa, Milano",1.500,100 
,2 ,Bilocale a Paderno Dugnano,450,45 
,2 ,Bilocale a Magenta,450,60 
 con ascensore,,"Monolocale in via luigi federico menabrea, 25, Dergano, Milano",600,40 
 con ascensore,2 ,"Bilocale in via monte nero, 62, Cinque Giornate-Montenero-Libia, Milano",850,60 
 senza ascensore,2 ,"Bilocale in largo domodossola, 2, Portello-Tre Torri, Milano",1.084,80 
 senza ascensore,3 ,"Trilocale in via enrico nöe, 1, Romagna, Milano",1.500,85 
 con ascensore,4 ,"Quadrilocale in via innocenzo isimbardi, 29, Chiesa Rossa, Milano",1.500,100 
,2 ,Bilocale a Paderno Dugnano,450,45 
,2 ,Bilocale a Magenta,450,60 
 con ascensore,,"Monolocale in via luigi federico menabrea, 25, Dergano, Milano",600,40 
 con ascensore,2 ,"Bilocale in via monte nero, 62, Cinque Giornate-Montenero-Libia, Milano",850,60 
 senza ascensore,2 ,"Bilocale in largo domodossola, 2, Portello-Tre Torri, Milano",1.084,80 
 senza ascensore,3 ,"Trilocale in via enrico nöe, 1, Romagna, Milano",1.500,85 
 con ascensore,2 ,"Bilocale in via antonio tolomeo trivulzio, 14, Bande Nere, Milano",750,45 
 senza ascensore,3 ,Trilocale a Casorezzo,400,95 
,3 ,Trilocale a Casorezzo,400,95 
 senza ascensore,3 ,Trilocale a Casorezzo,400,95 
 con ascensore,2 ,"Bilocale in via palmaria, 2, Affori, Milano",800,56 
,5 ,"Appartamento in via friuli, s.n.c, Cinque Giornate-Montenero-Libia, Milano",1.700,180 
 con ascensore,,"Monolocale in piazzale ferdinando martini, 7, Martini-Cuoco, Milano",600,40 
 con ascensore,3 ,"Trilocale in Brianza-Pasteur, Milano",900,90 
 senza ascensore,3 ,"Trilocale in via aleardo aleardi, 14, Cenisio-Sarpi, Milano",1.100,65 
 senza ascensore,2 ,"Appartamento su due piani in via Salesina, 3, Parco Forlanini, Milano",600,80 
,3 ,"Trilocale in Area Novegro-San Felice, Segrate",950,110 
 ,3 ,Trilocale a Novate Milanese,900,110 
 con ascensore,,"Monolocale in via Tonale, 12, Greco-Villaggio dei Giornalisti, Milano",650,35 
 con ascensore,,"Monolocale in via nicola antonio porpora, s.n.c, Teodosio-Porpora, Milano",650,40 
 senza ascensore,,"Monolocale in via nicola antonio porpora, s.n.c, Teodosio-Porpora, Milano",700,45 
 con ascensore,2 ,"Bilocale in via giuseppe mercalli, s.n.c, Mercalli-Quadronno, Milano",1.300,73 
 con ascensore,2 ,"Bilocale in via lazzaro spallanzani, 6, Indipendenza-Regina Giovanna, Milano",1.200,50 
 con ascensore,2 ,"Bilocale in viale Sarca, 324, Bicocca, Milano",800,74 
 con ascensore,2 ,"Bilocale in via alfonso capecelatro, 27, Morgantini, Milano",550,60 
 con ascensore,2 ,"Bilocale in piazzale Loreto, 1, Brianza-Pasteur, Milano",700,45 
,,"Monolocale in via bari, 4, Naviglio Grande-Barona, Milano",500,30 
 con ascensore,2 ,"Bilocale in via carlo pisacane, 18, Indipendenza-Regina Giovanna, Milano",800,45 
,2 ,"Bilocale in via Carlo Darwin, 8, Navigli-Porta Genova, Milano",900,45 
 con ascensore,2 ,"Bilocale in via marco greppi, 10, Martini-Cuoco, Milano",715,75 
 con ascensore,2 ,Bilocale a Corbetta,580,67 
 con ascensore,3 ,"Trilocale in via achille maiocchi, Abruzzi, Milano",1.650,95 
,2 ,Bilocale a Corbetta,580,67 
 senza ascensore,2 ,"Bilocale in piazza francesco durante, 36, Teodosio-Porpora, Milano",900,45 
,4 ,"Quadrilocale in Area Novegro-San Felice, Segrate",1.750,150 
 con ascensore,4 ,"Quadrilocale in via vincenzo monti, 12, Ariosto-Magenta, Milano",2.166,100 
 con ascensore,2 ,"Bilocale in privata antonio meucci, 1, Crescenzago, Milano",750,70 
 con ascensore,2 ,"Bilocale in via Stendhal, 71, San Vittore-Washington, Milano",850,75 
 con ascensore,2 ,"Bilocale in piazza cinque giornate, 1, Palestro, Milano",750,50 
 con ascensore,2 ,"Bilocale in via lazzaro papi, 3, Cinque Giornate-Montenero-Libia, Milano",1.200,50 
,3 ,"Appartamento su due piani in via giovanni battista nazari, 5, Indipendenza-Regina Giovanna, Milano",1.150,90 
 senza ascensore,2 ,"Bilocale in via digione, 9, San Vittore-Washington, Milano",730,45 
 con ascensore,4 ,"Quadrilocale in via vittor pisani, 2, Centrale, Milano",2.500,140 
 senza ascensore,,"Monolocale in via milazzo, 4, Moscova-Repubblica, Milano",1.000,70 
 con ascensore,2 ,"Bilocale in via francesco guicciardini, 5, Indipendenza-Regina Giovanna, Milano",1.300,70 
 con ascensore,2 ,"Appartamento su due piani in via Aurelio Marco, 64, Brianza-Pasteur, Milano",1.100,60 
 senza ascensore,2 ,"Bilocale in via fratelli cervi, 2, Cesate",650,75 
 con ascensore,2 ,"Bilocale in via valtorta, 7, Gorla, Milano",750,47 
,3 ,"Trilocale in via bonaventura broggini, 25, Baggio, Milano",850,110 
 con ascensore,2 ,"Bilocale in via antonio gramsci, 60, Vimodrone",899,70 
 ,2 ,"Bilocale in via giovanni battista fauchè, 34, Sempione, Milano",800,50 
 con ascensore,,"Monolocale in via della sila, s.n.c, Teodosio-Porpora, Milano",700,40 
 con ascensore,2 ,"Bilocale in via piero martinetti, 14, Bande Nere, Milano",900,70 
,2 ,Bilocale a Corbetta,550,60 
 con ascensore,,"Monolocale in via privata cascia, 6, Crescenzago, Milano",800,90 
,2 ,"Bilocale in via luigi einaudi, s.n.c, Magnago",450,60 
,,"Monolocale in via piave, s.n.c, Palestro, Milano",1.300,50 
 ,2 ,Bilocale a Cologno Monzese,550,55 
 con ascensore,2 ,"Bilocale in via alberto da giussano, 17, Ariosto-Magenta, Milano",2.416,90 
 con ascensore,3 ,"Trilocale in via fratelli cervi, 7, Milano Due, Segrate",1.000,127 
,7 ,"Villetta bifamiliare in via italia, 40, Vanzago",1.500,280 
 con ascensore,2 ,"Bilocale in corso Sempione, 76, Sempione, Milano",1.500,55 
 con ascensore,2 ,"Bilocale in via dei pini, 2, Pieve Emanuele",680,75 
 con ascensore,3 ,"Trilocale in via Rogoredo, 113, Rogoredo-Santa Giulia, Milano",840,95 
 con ascensore,3 ,"Trilocale in via Giosuè Carducci, 3, Cinisello, Cinisello Balsamo",630,95 
 con ascensore,6 ,"Appartamento in via vittor pisani, 2, Centrale, Milano",2.500,140 
 con ascensore,5 ,"Appartamento in foro buonaparte, Duomo-Castello, Milano",3.500,260 
 con ascensore,5 ,"Appartamento in via giosué carducci, 12, San Vittore-Washington, Milano",2.000,145 
 con ascensore,,"Monolocale in via dei tulipani, 3, Lorenteggio-Giambellino, Milano",800,47 
 con ascensore,2 ,"Bilocale in via privata antonio meucci, 1, Crescenzago, Milano",800,70 
,2 ,"Bilocale in Res. Cedri, s.n.c, Segrate",750,65 
 senza ascensore,,"Appartamento su due piani in via privata giovanni ventura, 5, Lambrate, Milano",1.650,120 
 senza ascensore,2 ,"Bilocale in via Della Braida, 3, Tribunale, Milano",1.000,50 
 con ascensore,3 ,"Trilocale in via cesare battisti, 1, Paderno Dugnano",680,100 
 con ascensore,3 ,"Trilocale in via Guglielmo Pepe, 36, Garibaldi-Isola, Milano",1.200,60 
 con ascensore,,"Monolocale in via Gianfranco Zuretti, 31, Greco-Villaggio dei Giornalisti, Milano",600,40 
 senza ascensore,2 ,"Bilocale in via Giambellino, 150, Lorenteggio-Giambellino, Milano",750,65 
 con ascensore,2 ,"Bilocale in via Melchiorre Delfico, 24, Govone, Milano",850,50 
,2 ,"Bilocale in via Giuseppe Ripamonti, 367, Chiaravalle, Milano",850,65 
 con ascensore,,"Monolocale in Brianza-Pasteur, Milano",700,38 
 con ascensore,4 ,"Quadrilocale in via Palmiro Togliatti, 42, Mazzo-Terrazzano-Pantanedo, Rho",1.300,110 
 con ascensore,,"Monolocale in via Monte Penice, 6, Rozzano",900,45 
 senza ascensore,3 ,"Trilocale in via Giovanni de Alessandri, s.n.c, San Vittore-Washington, Milano",700,65 
 senza ascensore,2 ,"Attico in via Marcantonio dal Re, 10, Accursio, Milano",1.050,50 
 con ascensore,2 ,"Bilocale in via Cesare Battisti, 18, San Donato Milanese",1.300,70 
 con ascensore,3 ,"Trilocale in Brianza-Pasteur, Milano",900,100 
 con ascensore,,"Monolocale in via Delle Asole, 4, Vetra-Missori, Milano",900,35 
 con ascensore,3 ,"Trilocale in via Cesare Balbo, 11, Bligny-Toscana, Milano",1.350,100 
,3 ,"Appartamento su due piani in via Piemonte, 35, Motta Visconti",700,90 
 senza ascensore,2 ,"Attico in via Marcantonio dal Re, 10, Accursio, Milano",1.050,50 
 con ascensore,2 ,"Bilocale in via Cesare Battisti, 18, San Donato Milanese",1.300,70 
 con ascensore,3 ,"Trilocale in Brianza-Pasteur, Milano",900,100 
 con ascensore,,"Monolocale in via Delle Asole, 4, Vetra-Missori, Milano",900,35 
 con ascensore,3 ,"Trilocale in via Cesare Balbo, 11, Bligny-Toscana, Milano",1.350,100 
,3 ,"Appartamento su due piani in via Piemonte, 35, Motta Visconti",700,90 
 con ascensore,,"Monolocale in via Avancinio Avancini, 4, Chiesa Rossa, Milano",810,40 
 con ascensore,4 ,"Quadrilocale in viale Ca' Granda, 2, Cà Granda, Milano",1.200,100 
,2 ,"Bilocale in via Volvinio, 22, Chiesa Rossa, Milano",800,60 
 con ascensore,2 ,"Bilocale in via brembo, Ortles, Milano",1.050,80 
,,"Monolocale in via san marco, Sesto Marelli, Sesto San Giovanni",450,18 
 con ascensore,,"Monolocale in via francesco cavezzali, Turro, Milano",320,15 
 ,3 ,"Trilocale in piazza giovanni bausan, Bovisa, Milano",750,70 
,2 ,"Bilocale in via alberto nota, 46, Bicocca, Milano",950,60 
 ,2 ,"Bilocale in via privata poggibonsi, Bande Nere, Milano",600,60 
 ,,"Monolocale in via privata preneste, Morgantini, Milano",520,35 
 con ascensore,,"Monolocale in via sebino, Martini-Cuoco, Milano",500,33 
 con ascensore,,"Monolocale in via coluccio salutati, San Vittore-Washington, Milano",780,45 
 ,2 ,"Bilocale in via santa rita da cascia, Naviglio Grande-Barona, Milano",650,45 
 con ascensore,,"Monolocale in via de lilla, 4, San Giovanni, Rho",700,45 
,,"Monolocale in via corsica, 4, Argonne-Corsica, Milano",680,35 
 senza ascensore,2 ,"Bilocale in via acquati, 18, Cormano",700,70 
,2 ,"Bilocale in via andre costa, 2, Corsico",750,55 
 ,,"Monolocale in via romolo gessi, San Vittore-Washington, Milano",1.000,60 
 con ascensore,,"Monolocale in corso sempione, 76, Sempione, Milano",1.050,45 
 con ascensore,3 ,"Trilocale in via monte nero, s.n.c, Cinque Giornate-Montenero-Libia, Milano",1.550,70 
 con ascensore,2 ,"Bilocale in via privata umberto masotto, 29, Argonne-Corsica, Milano",650,60 
 senza ascensore,3 ,"Trilocale in via pinturicchio, 18, Romagna, Milano",1.080,90 
 senza ascensore,,"Monolocale in via michele pericle negrotto, 8, Varesina-Testori, Milano",450,30 
,4 ,"Quadrilocale in corso monforte, s.n.c, Palestro, Milano",2.900,140 
 con ascensore,4 ,"Quadrilocale in corso magenta, s.n.c, Ariosto-Magenta, Milano",2.750,140 
 ,2 ,"Bilocale in via reali, Paderno Dugnano",650,55 
 senza ascensore,2 ,"Bilocale in via micca, s.n.c, Bresso",600,60 
,2 ,"Bilocale in via giuseppe ripamonti, s.n.c, Vigentino, Milano",800,65 
 senza ascensore,2 ,"Bilocale in via raffaele lambruschini, s.n.c, Bovisa, Milano",600,50 
 con ascensore,3 ,"Trilocale in via marco greppi, 10, Martini-Cuoco, Milano",915,74 
 con ascensore,2 ,"Bilocale in via dante alighieri, 3, Gorgonzola",550,65 
 con ascensore,2 ,"Bilocale in via carlo boncompagni, Sulmona, Milano",550,45 
 con ascensore,2 ,"Bilocale in via romagna, 12, Argonne-Corsica, Milano",850,65 
 senza ascensore,2 ,"Bilocale in corso di porta ticinese, 70, Navigli-Porta Genova, Milano",908,65 
 con ascensore,,"Monolocale in piazza insubria, 8, Martini-Cuoco, Milano",650,28 
 senza ascensore,2 ,"Bilocale in via g. giacomo mora, 12, Vetra-Missori, Milano",1.500,60 
,2 ,"Bilocale in via dell'ambrosiana, 22, Vetra-Missori, Milano",1.600,80 
 con ascensore,3 ,"Trilocale in largo rovedine, 6, Opera",700,80 
 con ascensore,,"Monolocale in trivulzio, 3, San Vittore-Washington, Milano",600,40 
 con ascensore,3 ,"Trilocale in via sant'agnese, s.n.c, Zona Sant`Ambrogio-Università Cattolica, Milano",2.333,120 
 con ascensore,2 ,"Bilocale in via giuseppe lagrange, 3, Navigli-Porta Genova, Milano",700,50 
,2 ,"Bilocale in via monte nero, s.n.c, Cinque Giornate-Montenero-Libia, Milano",950,48 
 senza ascensore,2 ,"Bilocale in via giuseppe mercalli, 7, Mercalli-Quadronno, Milano",1.300,68 
 con ascensore,2 ,"Bilocale in via eugenio curiel, 194, Rozzano",700,60 
,3 ,"Casa indipendente in via della chiesa rossa, 247, Gratosoglio, Milano",2.000,65 
,2 ,"Casa indipendente in via della chiesa rossa, 247, Gratosoglio, Milano",1.600,55 
 senza ascensore,2 ,"Bilocale in via praga, 54, Bollate",550,50 
 con ascensore,2 ,"Bilocale in piazza giuseppe grandi, 19, Indipendenza-Regina Giovanna, Milano",950,65 
 senza ascensore,,"Monolocale in via achille feraboli, 39, Gratosoglio, Milano",550,40 
 senza ascensore,2 ,"Bilocale in via giuseppe mazzini, 49, Rozzano",550,55 
 con ascensore,2 ,"Bilocale in corso di porta romana, 85, Mercalli-Quadronno, Milano",1.300,65 
 con ascensore,3 ,"Trilocale in via passo rolle, 39, Udine, Milano",1.050,95 
 con ascensore,3 ,"Trilocale in via capo palinuro, 2, Naviglio Grande-Barona, Milano",960,80 
 con ascensore,2 ,"Bilocale in piazza aspromonte, Romagna, Milano",750,50 
 con ascensore,4 ,"Quadrilocale in Vittorio Emanuele-Augusto, Milano",4.000,100 
,3 ,Trilocale a Cornaredo,750,110 
 senza ascensore,3 ,"Trilocale in corso sempione, 27, Sant'Erasmo-Ospedale Vecchio, Legnano",650,85 
 con ascensore,3 ,"Attico in Palestro, Milano",1.600,115 
 con ascensore,2 ,"Bilocale in Ariosto-Magenta, Milano",1.450,100 
 con ascensore,3 ,"Trilocale in Axum-San Carlo, Milano",1.100,110 
,2 ,Bilocale a Inveruno,450,55 
 con ascensore,2 ,"Bilocale in Zona Sant`Ambrogio-Università Cattolica, Milano",1.900,80 
,3 ,"Trilocale in Quarto Oggiaro-Euromilano, Milano",550,75 
,2 ,"Bilocale in Ariosto-Magenta, Milano",1.500,60 
,5 ,Villetta bifamiliare a Busto Garolfo,1.100,250 
 con ascensore,3 ,"Trilocale in via sordello, Rogoredo-Santa Giulia, Milano",800,75 
,2 ,"Bilocale in via ungheria, Rogoredo-Santa Giulia, Milano",650,60 
 con ascensore,2 ,"Bilocale in Greco-Villaggio dei Giornalisti, Milano",700,60 
 con ascensore,4 ,"Quadrilocale in Ariosto-Magenta, Milano",3.500,200 
 con ascensore,5 ,"Appartamento in Brera-Montenapoleone, Milano",3.500,170 
 con ascensore,,"Monolocale in Moscova-Repubblica, Milano",1.200,40 
 con ascensore,8 ,"Appartamento in Ariosto-Magenta, Milano",7.100,300 
 con ascensore,8 ,"Appartamento in Ariosto-Magenta, Milano",7.500,350 
 con ascensore,3 ,"Trilocale in Fiera, Milano",1.100,100 
 ,2 ,Bilocale a Arese,700,90 
,6 ,"Attico in Ariosto-Magenta, Milano",7.080,330 
,2 ,"Bilocale in via sassari, Gorla, Milano",543,60 
 con ascensore,2 ,"Bilocale in via cappuccio, s.n.c, Zona Sant`Ambrogio-Università Cattolica, Milano",1.416,87 
,3 ,"Trilocale in via sassari, Gorla, Milano",620,80 
 con ascensore,5 ,"Appartamento in via cesare battisti, 21, Palestro, Milano",2.500,200 
 con ascensore,3 ,"Trilocale in corso monforte, Vittorio Emanuele-Augusto, Milano",3.300,110 
 senza ascensore,2 ,Bilocale a Inveruno,450,60 
 ,2 ,"Bilocale in Brera-Montenapoleone, Milano",2.000,50 
,6 ,"Appartamento in Mercalli-Quadronno, Milano",7.170,250 
,3 ,"Trilocale in via sassari, Gorla, Milano",620,80 
 con ascensore,5 ,"Appartamento in via cesare battisti, 21, Palestro, Milano",2.500,200 
 con ascensore,3 ,"Trilocale in corso monforte, Vittorio Emanuele-Augusto, Milano",3.300,110 
 senza ascensore,2 ,Bilocale a Inveruno,450,60 
 ,2 ,"Bilocale in Brera-Montenapoleone, Milano",2.000,50 
,6 ,"Appartamento in Mercalli-Quadronno, Milano",7.170,250 
 con ascensore,5 ,"Appartamento in Brera-Montenapoleone, Milano",4.166,210 
,2 ,Bilocale a Vanzago,650,55 
 con ascensore,2 ,"Bilocale in via california, 3, San Vittore-Washington, Milano",850,55 
 con ascensore,4 ,"Quadrilocale in Solari-Savona-Tortona, Milano",2.200,130 
 con ascensore,3 ,"Appartamento su due piani in Vetra-Missori, Milano",2.000,120 
 ,3 ,"Trilocale in Brera-Montenapoleone, Milano",2.750,135 
,2 ,"Bilocale in Navigli-Porta Genova, Milano",1.100,55 
,2 ,Bilocale a Castano Primo,500,60 
