elevator,rooms,address,price,size
 ,,"Monolocale in via cristoforo gluck, Greco-Villaggio dei Giornalisti, Milano",440,30 
 con ascensore,3 ,"Trilocale in via andrea costa, 7, Teodosio-Porpora, Milano",1.200,60 
 con ascensore,,"Monolocale in via ascanio sforza, Navigli-Porta Genova, Milano",1.200,50 
 con ascensore,2 ,"Bilocale in via monte bianco, Fiera, Milano",850,50 
 con ascensore,2 ,"Bilocale in via mario pieri, Crescenzago, Milano",640,55 
 con ascensore,,"Monolocale in via cevedale, Dergano, Milano",600,50 
 con ascensore,2 ,"Bilocale in Teodosio-Porpora, Milano",550,18 
 senza ascensore,2 ,"Bilocale in via savona, 5, Navigli-Porta Genova, Milano",990,65 
 ,2 ,"Bilocale in via valtorta, Gorla, Milano",680,75 
,3 ,"Trilocale in via Angelo Airaghi, Settimo Milanese",750,95 
 con ascensore,2 ,"Bilocale in via passo buole, s.n.c, Bligny-Toscana, Milano",900,70 
,2 ,"Bilocale in via toscana, s.n.c, Bligny-Toscana, Milano",750,50 
 senza ascensore,3 ,"Trilocale in via scipione pistrucci, s.n.c, Martini-Cuoco, Milano",1.100,85 
 con ascensore,3 ,Trilocale in ,1.000,70 
 con ascensore,2 ,"Bilocale in via carolina invernizio, Quarto Oggiaro-Euromilano, Milano",600,60 
 con ascensore,,"Monolocale in via Giacomo Matteotti, 1, Ozzero",390,38 
 con ascensore,,"Monolocale in via torino, 15, Duomo-Castello, Milano",1.550,45 
,2 ,"Bilocale in via leonardo da vinci, Bussero",600,65 
 con ascensore,3 ,"Trilocale in via filippo corridoni, s.n.c, Palestro, Milano",1.100,60 
,2 ,"Bilocale in via privata faiti, 9, Niguarda, Milano",850,75 
 con ascensore,,"Monolocale in via palmanova, Crescenzago, Milano",350,23 
 con ascensore,3 ,"Trilocale in via alfonso capecelatro, 45, San Siro, Milano",900,90 
 con ascensore,2 ,"Bilocale in via piero martinetti, 31, Bande Nere, Milano",750,60 
,2 ,"Villetta a schiera in via abramo lincoln, Indipendenza-Regina Giovanna, Milano",1.800,100 
 con ascensore,4 ,"Quadrilocale in via cesare battisti, 3, Paderno Dugnano",680,100 
 con ascensore,3 ,"Trilocale in via papa giovanni xxiii, 36, Sedriano",630,110 
 con ascensore,,"Monolocale in via tolmezzo, 18, Udine, Milano",580,35 
 ,2 ,"Bilocale in via giuseppe giusti, Bollate",500,60 
,2 ,"Bilocale in via caprera, San Vittore-Washington, Milano",900,55 
 con ascensore,3 ,"Trilocale in via caterina da forlì, Bande Nere, Milano",900,95 
 ,2 ,"Bilocale in via bramante, Cenisio-Sarpi, Milano",1.300,55 
 con ascensore,2 ,"Bilocale in via san maurilio, Zona Sant`Ambrogio-Università Cattolica, Milano",1.500,75 
 con ascensore,2 ,"Appartamento su due piani in via conchetta, Navigli-Porta Genova, Milano",1.100,60 
 con ascensore,3 ,"Trilocale in via gian giacomo mora, Vetra-Missori, Milano",1.600,90 
,7 ,"Appartamento su due piani in piazza giovanni amendola, Fiera, Milano",5.100,360 
 con ascensore,2 ,"Bilocale in corso lodi, Martini-Cuoco, Milano",850,55 
 con ascensore,2 ,"Bilocale in via gaspare aselli, 11, Argonne-Corsica, Milano",800,70 
 con ascensore,2 ,"Bilocale in via san francesco d'assisi, Opera",550,55 
 con ascensore,3 ,"Trilocale in via andrea appiani, Moscova-Repubblica, Milano",2.200,125 
 con ascensore,2 ,"Bilocale in corso di porta romana, Mercalli-Quadronno, Milano",1.400,67 
 con ascensore,2 ,"Bilocale in via bligny, Bligny-Toscana, Milano",1.300,55 
 con ascensore,2 ,"Bilocale in via raffaello sanzio, Fiera, Milano",940,55 
 con ascensore,2 ,"Bilocale in via luigi giuseppe faravelli, Portello-Tre Torri, Milano",900,72 
 con ascensore,,"Monolocale in corso di porta romana, Mercalli-Quadronno, Milano",700,45 
 con ascensore,2 ,"Bilocale in via lombardia, Pregnana Milanese",650,115 
,,"Monolocale in via roma, Novate Milanese",550,40 
 ,,"Monolocale in via lambro, Indipendenza-Regina Giovanna, Milano",500,20 
 con ascensore,2 ,"Bilocale in via marco aurelio, Brianza-Pasteur, Milano",750,60 
 con ascensore,,"Monolocale in via Fulcorina, Zona Sant`Ambrogio-Università Cattolica, Milano",900,30 
 con ascensore,2 ,"Bilocale in via archimede, Indipendenza-Regina Giovanna, Milano",900,80 
 con ascensore,3 ,"Trilocale in via montello, Corsico",600,68 
 con ascensore,,"Monolocale in via toscana, s.n.c, Bligny-Toscana, Milano",600,25 
 con ascensore,2 ,"Bilocale in piazza enrico bottini, s.n.c, Teodosio-Porpora, Milano",1.100,65 
 ,4 ,"Quadrilocale in via francesco de sanctis, Chiesa Rossa, Milano",1.600,110 
 con ascensore,2 ,"Bilocale in via giulio romano, Bligny-Toscana, Milano",1.000,50 
 con ascensore,2 ,"Bilocale in Ortles, Milano",600,45 
 con ascensore,2 ,"Bilocale in galleria del corso, Vittorio Emanuele-Augusto, Milano",900,55 
 con ascensore,2 ,"Bilocale in via gianfranco zuretti, Greco-Villaggio dei Giornalisti, Milano",530,65 
,,"Monolocale in via luigi capuana, San Carlo-San Paolo-Stellanda, Rho",550,40 
,2 ,"Bilocale in via giuseppe verdi, San Giuliano Milanese",600,45 
 ,2 ,"Bilocale in via brera, Brera-Montenapoleone, Milano",1.500,65 
 senza ascensore,3 ,"Trilocale in via Pezzotti Giovanni, 11, Cermenate-Meda, Milano",1.800,130 
,2 ,"Bilocale in largo rovedine, Opera",650,55 
 con ascensore,3 ,"Trilocale in via Bezzi, 79, San Vittore-Washington, Milano",800,80 
 con ascensore,4 ,"Quadrilocale in piazza umanitaria, s.n.c, Tribunale, Milano",2.000,150 
 con ascensore,7 ,"Appartamento in piazza eleonora duse, Palestro, Milano",8.100,350 
 con ascensore,4 ,"Quadrilocale in piazza castello, Duomo-Castello, Milano",3.500,185 
 con ascensore,2 ,"Bilocale in via lodovico il moro, Naviglio Grande-Barona, Milano",700,55 
,2 ,"Bilocale in via dei biancospini, Lorenteggio-Giambellino, Milano",750,60 
 con ascensore,3 ,"Trilocale in via giuseppe verdi, Trezzano sul Naviglio",850,110 
 con ascensore,5 ,"Appartamento in via gerolamo borgazzi, Mercalli-Quadronno, Milano",2.250,155 
,3 ,"Trilocale in via ruggero bonghi, Cermenate-Meda, Milano",1.025,60 
 con ascensore,2 ,"Bilocale in via antonio gramsci, 40, Paderno Dugnano",550,70 
 con ascensore,4 ,"Quadrilocale in via enrico besana, Tribunale, Milano",2.500,180 
 con ascensore,4 ,"Quadrilocale in via messina, Cenisio-Sarpi, Milano",1.834,130 
 con ascensore,,"Monolocale in via etiopia, Soderini, Milano",550,31 
 con ascensore,2 ,"Bilocale in via francesco paolo michetti, Dergano, Milano",540,50 
,,"Monolocale in via tonale, Greco-Villaggio dei Giornalisti, Milano",800,30 
 con ascensore,2 ,"Bilocale in via pietro teuliè, Bligny-Toscana, Milano",1.300,65 
 con ascensore,2 ,"Bilocale in via solferino, Moscova-Repubblica, Milano",1.800,120 
,3 ,"Trilocale in via morigi, Zona Sant`Ambrogio-Università Cattolica, Milano",3.666,150 
 con ascensore,4 ,"Quadrilocale in via livorno, Palestro, Milano",3.500,155 
 con ascensore,,"Monolocale in via guglielmo ferrero, 10, Naviglio Grande-Barona, Milano",650,40 
 con ascensore,2 ,"Bilocale in via lodovico il moro, 85, Naviglio Grande-Barona, Milano",750,55 
 con ascensore,5 ,"Appartamento in corso magenta, Ariosto-Magenta, Milano",3.160,176 
 con ascensore,2 ,"Bilocale in via mecenate, 84, Mecenate, Milano",750,45 
 ,3 ,"Trilocale in via alessandro volta, Moscova-Repubblica, Milano",1.700,90 
,6 ,"Appartamento in via morigi, Zona Sant`Ambrogio-Università Cattolica, Milano",4.833,300 
 con ascensore,5 ,"Appartamento in piazza borromeo, Zona Sant`Ambrogio-Università Cattolica, Milano",3.666,166 
 con ascensore,2 ,"Bilocale in via g. pastore, Gorgonzola",650,60 
 senza ascensore,2 ,"Bilocale in via privata Vallarsa, 1, Ortles, Milano",780,60 
 con ascensore,2 ,"Bilocale in via pietro teuliè, Bligny-Toscana, Milano",1.100,65 
 ,3 ,"Trilocale in via giovanni pezzotti, Cermenate-Meda, Milano",1.800,120 
 con ascensore,2 ,"Bilocale in via ambrogio portaluppi, Naviglio Grande-Barona, Milano",950,70 
 con ascensore,3 ,"Trilocale in via bari, Naviglio Grande-Barona, Milano",800,85 
 con ascensore,3 ,"Trilocale in via don bosco, Brenta, Milano",1.200,70 
 con ascensore,,"Monolocale in via canaletto, Argonne-Corsica, Milano",700,50 
 con ascensore,2 ,"Bilocale in via guglielmo marconi, Pregnana Milanese",450,65 
 con ascensore,2 ,"Bilocale in via Boni Giacomo, 5, San Vittore-Washington, Milano",850,50 
 con ascensore,2 ,"Bilocale in via malachia marchesi de taddei, San Vittore-Washington, Milano",1.100,70 
,2 ,"Bilocale in via legnone, Dergano, Milano",900,50 
 con ascensore,,"Monolocale in via tonale, Greco-Villaggio dei Giornalisti, Milano",900,30 
 con ascensore,,"Monolocale in via delle rimembranze di lambrate, Lambrate, Milano",750,30 
,,"Monolocale in via giulio cesare procaccini, 41, Sempione, Milano",850,75 
 con ascensore,2 ,"Bilocale in via ungheria, 19, Rogoredo-Santa Giulia, Milano",730,55 
 ,2 ,"Bilocale in corso lodi, Brenta, Milano",750,50 
,3 ,"Trilocale in largo riccardo zandonai, Ariosto-Magenta, Milano",2.000,100 
 ,2 ,"Bilocale in via brusuglio, Affori, Milano",650,55 
 con ascensore,3 ,"Trilocale in via cecilio stazio, Teodosio-Porpora, Milano",900,70 
 con ascensore,3 ,"Trilocale in via giovanni pezzotti, Bligny-Toscana, Milano",1.400,80 
 con ascensore,3 ,"Trilocale in via giancarlo sismondi, s.n.c, Argonne-Corsica, Milano",1.200,90 
,2 ,"Bilocale in via della chiesa rossa, Chiesa Rossa, Milano",1.000,65 
 senza ascensore,2 ,Bilocale a Magenta,350,40 
 con ascensore,2 ,"Bilocale in via garigliano, Garibaldi-Isola, Milano",900,55 
 con ascensore,,"Monolocale in via malachia marchesi de taddei, San Vittore-Washington, Milano",590,25 
 con ascensore,,"Monolocale in via lodovico il moro, Lodovico il Moro, Milano",700,45 
,4 ,"Quadrilocale in via monte bianco, Fiera, Milano",1.300,100 
 con ascensore,2 ,"Bilocale in via papa giovanni xxiii, Bollate",550,50 
 con ascensore,2 ,"Bilocale in via mantova, Bligny-Toscana, Milano",900,48 
 ,3 ,"Trilocale in via fatebenefratelli, Moscova-Repubblica, Milano",2.500,145 
 con ascensore,3 ,"Trilocale in via vincenzo monti, Ariosto-Magenta, Milano",1.416,95 
 con ascensore,3 ,"Trilocale in via giacomo matteotti, San Donato Milanese",700,85 
 con ascensore,4 ,"Quadrilocale in via giosuè carducci, San Vittore-Washington, Milano",2.000,125 
 con ascensore,3 ,"Trilocale in via alessandro visconti d'aragona, Città Studi, Milano",900,100 
 con ascensore,3 ,"Trilocale in lorenteggio, 45, Lorenteggio-Giambellino, Milano",1.100,90 
 senza ascensore,2 ,"Bilocale in via mario fusetti, 15, Navigli-Porta Genova, Milano",1.250,70 
 ,2 ,"Bilocale in via conchetta, Navigli-Porta Genova, Milano",1.500,70 
 con ascensore,2 ,"Bilocale in via Parmigianino, 10, Fiera, Milano",800,60 
 ,2 ,"Bilocale in via friuli, Cinque Giornate-Montenero-Libia, Milano",1.250,80 
 con ascensore,2 ,"Bilocale in via valenza, Navigli-Porta Genova, Milano",1.100,65 
 ,2 ,"Bilocale in via ascanio sforza, Cermenate-Meda, Milano",1.400,70 
 ,2 ,"Bilocale in via emilio caldara, Cinque Giornate-Montenero-Libia, Milano",1.000,50 
 con ascensore,,"Monolocale in via sandro botticelli, Città Studi, Milano",750,40 
 senza ascensore,3 ,"Trilocale in via Tantardini Antonio, 20, Bligny-Toscana, Milano",1.300,90 
 senza ascensore,,"Monolocale in via lussinpiccolo, Istria, Milano",650,50 
 con ascensore,3 ,"Trilocale in via giuseppe ripamonti, Bligny-Toscana, Milano",2.000,115 
,2 ,"Bilocale in via ripamonti, Chiaravalle, Milano",800,65 
 con ascensore,,"Monolocale in via san mansueto, Bligny-Toscana, Milano",660,22 
 con ascensore,2 ,"Bilocale in teodosio, s.n.c, Teodosio-Porpora, Milano",850,60 
 con ascensore,2 ,"Bilocale in via delle cascine, San Donato Milanese",650,55 
,,"Monolocale in via voghera, Solari-Savona-Tortona, Milano",5.000,350 
 ,,"Monolocale in via alessandro volta, Legnarello-Frati-Olmina, Legnano",400,35 
 con ascensore,,"Monolocale in via giulio romano, Bligny-Toscana, Milano",680,25 
,3 ,"Trilocale in via romagna, 48, Città Studi, Milano",1.250,75 
,2 ,"Bilocale in via francesco guicciardini, Indipendenza-Regina Giovanna, Milano",1.250,70 
 con ascensore,2 ,"Bilocale in via privata san mansueto, 4, Bligny-Toscana, Milano",1.100,55 
 con ascensore,10 ,"Attico in corso monforte, Palestro, Milano",7.500,370 
 con ascensore,5 ,"Attico in via pallavicino, Ariosto-Magenta, Milano",5.100,205 
 con ascensore,4 ,"Quadrilocale in largo cairoli, Duomo-Castello, Milano",3.420,185 
 con ascensore,5 ,"Appartamento in poliziano, Sempione, Milano",2.200,180 
 con ascensore,4 ,"Quadrilocale in zambeletti, Abruzzi, Milano",2.200,128 
 con ascensore,2 ,"Bilocale in corso porta ticinese, Mercalli-Quadronno, Milano",1.000,62 
 senza ascensore,2 ,"Bilocale in via filippo carcano, 10, Fiera, Milano",1.000,53 
,3 ,Casa indipendente a Lacchiarella,550,66 
 con ascensore,2 ,"Bilocale in via federico caprilli, San Siro, Milano",1.000,55 
,2 ,"Bilocale in via porta ronca, Centro, Rho",500,60 
 senza ascensore,3 ,"Appartamento su due piani in via Longhena, Corvetto, Milano",1.150,100 
 con ascensore,3 ,"Trilocale in via turati, Moscova-Repubblica, Milano",2.166,125 
 con ascensore,2 ,"Bilocale in via privata Bastia, 6, Ortles, Milano",900,60 
 con ascensore,2 ,"Bilocale in via federico caprilli, 13, San Siro, Milano",1.000,55 
 con ascensore,3 ,"Trilocale in alzaia naviglio pavese, Chiesa Rossa, Milano",1.500,80 
 con ascensore,4 ,"Quadrilocale in via lario, Istria, Milano",2.000,138 
 con ascensore,3 ,"Trilocale in spinola, Fiera, Milano",2.600,117 
,2 ,"Bilocale in via carlo farini, Garibaldi-Isola, Milano",1.250,80 
 ,2 ,"Bilocale in via giovanni pascoli, Parabiago",500,65 
 senza ascensore,3 ,"Trilocale in via monte grappa, 9, Calvignasco",400,80 
 ,3 ,"Trilocale in via sandro pertini, Besate",500,90 
 con ascensore,,"Monolocale in via stampa, Vetra-Missori, Milano",534,30 
,,"Monolocale in via bordighera, Cermenate-Meda, Milano",550,37 
 con ascensore,3 ,"Trilocale in via roma, Bresso",575,95 
 ,2 ,"Bilocale in via franco tosi, Naviglio Grande-Barona, Milano",790,50 
 ,2 ,"Bilocale in via ruggero bonghi, Cermenate-Meda, Milano",800,50 
,,"Monolocale in via cristoforo colombo, Basiglio",500,45 
 con ascensore,2 ,"Bilocale in via giuseppe di vittorio, Quinto Romano, Milano",650,50 
 con ascensore,3 ,"Trilocale in corso genova, s.n.c, Navigli-Porta Genova, Milano",1.200,105 
 con ascensore,4 ,"Attico in via fernando santi, Lodovico il Moro, Milano",1.850,140 
,2 ,"Bilocale in via privata sebastiano serlio, Brenta, Milano",750,70 
,3 ,"Trilocale in Bovisa, Milano",850,95 
 con ascensore,5 ,"Appartamento in piazza san babila, Vittorio Emanuele-Augusto, Milano",3.000,230 
 con ascensore,3 ,"Trilocale in corso italia, Vetra-Missori, Milano",2.250,140 
 con ascensore,,"Monolocale in via carlo espinasse, Varesina-Testori, Milano",750,48 
,2 ,"Bilocale in via lombardia, Motta Visconti",500,55 
 ,,"Monolocale in via padova, Crescenzago, Milano",350,36 
,2 ,"Bilocale in via giovanni duprè, Govone, Milano",710,70 
 senza ascensore,2 ,"Bilocale in via turati, San Giuliano Milanese",600,55 
,,"Monolocale in via tucidide, Parco Forlanini, Milano",700,65 
 con ascensore,3 ,"Trilocale in via galvano fiamma, s.n.c, Indipendenza-Regina Giovanna, Milano",1.500,95 
 con ascensore,2 ,"Bilocale in via giuseppe giacosa, 47, Brianza-Pasteur, Milano",690,45 
,3 ,"Trilocale in via privata tirso, Vigentino, Milano",1.500,95 
 con ascensore,4 ,"Quadrilocale in via baldassare oltrocchi, Martini-Cuoco, Milano",2.400,180 
,,"Monolocale in via Caianello, 25, Dergano, Milano",650,40 
 con ascensore,3 ,"Trilocale in via osti, Vetra-Missori, Milano",1.580,100 
 con ascensore,2 ,"Bilocale in corso sempione, 88, Sempione, Milano",1.100,60 
 con ascensore,3 ,"Trilocale in via arluno, Pogliano Milanese",680,80 
 con ascensore,5 ,"Appartamento in via santa maria valle, Vetra-Missori, Milano",3.330,235 
 con ascensore,3 ,"Trilocale in via giosuè carducci, Trezzano sul Naviglio",950,110 
 con ascensore,5 ,"Appartamento in foro buonaparte, s.n.c, Duomo-Castello, Milano",3.500,180 
 con ascensore,,"Monolocale in via savona, 101, Lorenteggio-Giambellino, Milano",650,40 
 senza ascensore,2 ,"Bilocale in via Falcone Borsellino, 1, Calvignasco",600,90 
 ,2 ,"Bilocale in via cavour, Novate Milanese",690,80 
 con ascensore,2 ,"Bilocale in via Ravizza, 21, Fiera, Milano",916,42 
 senza ascensore,3 ,"Trilocale in via rovigno, 23, Gorla, Milano",2.200,80 
 senza ascensore,2 ,"Bilocale in via benedetto menzini, 6, Bande Nere, Milano",900,70 
 con ascensore,2 ,"Bilocale in via caduti di nassirya, Peschiera Borromeo",640,60 
 con ascensore,2 ,"Bilocale in piazza bruno buozzi, Bligny-Toscana, Milano",1.100,90 
 con ascensore,2 ,"Bilocale in via cenisio, Govone, Milano",950,60 
 ,,"Monolocale in via nicola antonio porpora, Teodosio-Porpora, Milano",750,25 
 con ascensore,3 ,Trilocale a Arese,900,100 
 con ascensore,,"Monolocale in palazzo dei cigni, Basiglio",750,53 
,2 ,"Bilocale in piazzale carlo archinto, Garibaldi-Isola, Milano",850,50 
 senza ascensore,,"Monolocale in via luigi pasteur, Brianza-Pasteur, Milano",820,55 
 senza ascensore,2 ,"Bilocale in via Cassanese, 33, Milano Due, Segrate",500,40 
 con ascensore,4 ,"Quadrilocale in via gian paolo annoni, 8, Motta Visconti",500,100 
,4 ,"Quadrilocale in piazza san marco, Moscova-Repubblica, Milano",2.800,140 
 con ascensore,4 ,"Attico in via fernando santi, Lodovico il Moro, Milano",1.660,150 
 con ascensore,4 ,"Quadrilocale in via gian giacomo mora, Vetra-Missori, Milano",2.500,150 
 con ascensore,2 ,"Bilocale in via cristoforo colombo, Basiglio",650,65 
 con ascensore,3 ,"Trilocale in via italia, 89, Paderno Dugnano",700,90 
 con ascensore,4 ,"Quadrilocale in via zurigo, Inganni, Milano",2.200,120 
 con ascensore,2 ,"Bilocale in via gorani, Zona Sant`Ambrogio-Università Cattolica, Milano",2.200,93 
,6 ,"Villa in via della chiesa, Basiglio",4.000,300 
 senza ascensore,,"Monolocale in via Savona, Solari-Savona-Tortona, Milano",900,30 
 con ascensore,3 ,"Trilocale in via massimo d'azeglio, 29, Rozzano",700,120 
 ,2 ,"Bilocale in via privata degli umiliati, Rogoredo-Santa Giulia, Milano",450,50 
 con ascensore,2 ,"Bilocale in via piero capponi, Ariosto-Magenta, Milano",1.000,50 
 con ascensore,5 ,"Appartamento in via benedetto marcello, Centrale, Milano",2.833,195 
 con ascensore,7 ,"Appartamento su due piani in via giuseppe verdi, Basiglio",2.500,250 
 con ascensore,2 ,"Bilocale in via san rocco, Bligny-Toscana, Milano",1.300,70 
 con ascensore,2 ,"Bilocale in via dante alighieri, Pieve Emanuele",780,80 
 con ascensore,6 ,"Appartamento in via alberto da giussano, Ariosto-Magenta, Milano",6.666,300 
 con ascensore,3 ,"Trilocale in via degli alerami, San Siro, Milano",2.333,150 
 ,6 ,"Appartamento in via degli odescalchi, San Siro, Milano",3.333,250 
 con ascensore,3 ,"Trilocale in via bianca maria, Palestro, Milano",5.000,300 
 con ascensore,6 ,"Appartamento in piazza santa maria beltrade, Vetra-Missori, Milano",3.915,260 
 con ascensore,6 ,"Appartamento in via cesare beccaria, Vittorio Emanuele-Augusto, Milano",3.250,190 
 con ascensore,,"Monolocale in via rickenbach, Melegnano",450,45 
,,"Monolocale in via arcangelo corelli, Parco Forlanini, Milano",870,80 
 con ascensore,2 ,"Bilocale in corso xxii marzo, Cinque Giornate-Montenero-Libia, Milano",1.050,66 
 con ascensore,,"Attico in via Varesina, 5, Accursio, Milano",790,70 
 con ascensore,2 ,"Bilocale in piazzale damiano chiesa, Portello-Tre Torri, Milano",800,68 
 con ascensore,4 ,"Quadrilocale in via pietro crespi, Brianza-Pasteur, Milano",2.050,90 
 con ascensore,3 ,"Trilocale in piazza esquilino, s.n.c, San Siro, Milano",1.416,110 
 con ascensore,2 ,"Bilocale in corso italia, Vetra-Missori, Milano",1.800,90 
 con ascensore,2 ,"Bilocale in via pasquale paoli, 2, Navigli-Porta Genova, Milano",1.000,54 
 ,2 ,"Bilocale in piazza sicilia, San Vittore-Washington, Milano",850,60 
 con ascensore,3 ,"Trilocale in via antonio fogazzaro, Cinque Giornate-Montenero-Libia, Milano",1.200,88 
 con ascensore,3 ,"Trilocale in via renato serra, Accursio, Milano",1.500,80 
 con ascensore,,"Monolocale in via regina giovanna, 17, Abruzzi, Milano",530,15 
,,"Monolocale in via Fratelli Bandiera, 1, Rescaldina",400,42 
,2 ,"Bilocale in via bernardino verro, 4, Vigentino, Milano",750,60 
 con ascensore,3 ,"Trilocale in via borsi, San Pietro-Pace, Rho",800,115 
 con ascensore,3 ,"Trilocale in via Giovanni Verga, 4, San Carlo-San Paolo-Stellanda, Rho",900,97 
,3 ,"Attico in via Cesare Beccaria, Vittorio Emanuele-Augusto, Milano",12.000,300 
 con ascensore,2 ,"Bilocale in via Caterina Da Forlì, Soderini, Milano",800,60 
 con ascensore,4 ,"Quadrilocale in via Guido Reni, 11, Trezzano sul Naviglio",1.190,140 
 con ascensore,3 ,"Trilocale in via Polesine, Corvetto, Milano",1.500,130 
,2 ,"Bilocale in via Polesine, Corvetto, Milano",950,65 
 con ascensore,,"Monolocale in via Pietro Colletta, Cinque Giornate-Montenero-Libia, Milano",850,45 
 con ascensore,3 ,"Trilocale in via Verdi, Melegnano",900,100 
 con ascensore,2 ,"Bilocale in via Maria Montessori, 14, Mecenate, Milano",850,50 
 con ascensore,4 ,"Quadrilocale in via Giovanni Boccaccio, Ariosto-Magenta, Milano",2.000,170 
 con ascensore,7 ,"Appartamento in via Giovanni Boccaccio, Ariosto-Magenta, Milano",3.000,230 
 con ascensore,3 ,"Trilocale in via Spartaco, Cinque Giornate-Montenero-Libia, Milano",1.480,120 
 con ascensore,,"Monolocale in via Malachia Marchesi de Taddei, 4, San Vittore-Washington, Milano",850,50 
 senza ascensore,3 ,"Trilocale in via Adige 8, 8, San Giorgio Su Legnano",900,110 
 con ascensore,2 ,"Bilocale in viale Corsica, 99, Argonne-Corsica, Milano",1.000,75 
 con ascensore,,"Monolocale in via Regina Giovanna, 17, Abruzzi, Milano",530,16 
 con ascensore,2 ,"Bilocale in via Carolina Invernizio, 3, Quarto Oggiaro-Euromilano, Milano",750,55 
 con ascensore,2 ,"Attico in via Giovanni Pascoli, Romagna, Milano",1.333,45 
 con ascensore,4 ,"Quadrilocale in via Villapizzone, 43, Varesina-Testori, Milano",1.200,120 
,2 ,"Bilocale in corso Italia, Vetra-Missori, Milano",1.500,70 
 senza ascensore,3 ,"Trilocale in via Ripamonti - V. Quaranta, Ortles, Milano",1.300,90 
 con ascensore,,"Monolocale in via Paolo Sarpi, 9, Cenisio-Sarpi, Milano",1.050,70 
,,"Monolocale in via Marco Bruto, 13, Mecenate, Milano",570,50 
 senza ascensore,2 ,"Bilocale in via Ruggero Bonghi, 12, Cermenate-Meda, Milano",900,70 
 con ascensore,3 ,"Trilocale in via Fratelli Cervi, 6, Milano Due, Segrate",1.250,95 
 con ascensore,3 ,"Trilocale in via Pordenone, 30, Udine, Milano",1.100,80 
,2 ,"Bilocale in via Gramsci, 58, Vimodrone",650,50 
,,"Monolocale in via Gramsci, 8, Rescaldina",400,45 
,4 ,"Casa indipendente in strada Esterna per Cascine San Pietro, 379, Cassano d'Adda",1.190,130 
 con ascensore,,"Appartamento su due piani in via Sesto San Giovanni, 31, Bicocca, Milano",690,45 
 con ascensore,5 ,"Appartamento in via Ogliari Pietro, 10, Chiesa Rossa, Milano",1.600,80 
 con ascensore,,"Monolocale in via Giuseppe Ugolini, 29, Cà Granda, Milano",800,50 
,2 ,"Bilocale in Martini-Cuoco, Milano",620,60 
 con ascensore,,"Monolocale in Ortles, Milano",700,50 
 con ascensore,3 ,"Trilocale in Lorenteggio-Giambellino, Milano",1.500,90 
 con ascensore,3 ,"Trilocale in Città Studi, Milano",1.600,110 
 con ascensore,2 ,"Bilocale in San Vittore-Washington, Milano",600,48 
 con ascensore,3 ,"Trilocale in Bovisa, Milano",750,68 
 con ascensore,3 ,"Trilocale in Rogoredo-Santa Giulia, Milano",830,80 
 con ascensore,2 ,"Bilocale in Garibaldi-Isola, Milano",850,50 
 con ascensore,,"Monolocale in Turro, Milano",600,35 
 con ascensore,,"Monolocale in Martini-Cuoco, Milano",500,33 
 con ascensore,2 ,"Bilocale in San Vittore-Washington, Milano",600,48 
 con ascensore,,"Monolocale in Morgantini, Milano",520,35 
 ,2 ,"Bilocale in Bande Nere, Milano",600,60 
 con ascensore,3 ,"Trilocale in Argonne-Corsica, Milano",1.000,75 
 con ascensore,,"Monolocale in Cermenate-Meda, Milano",620,38 
 con ascensore,,"Monolocale in Gorla, Milano",390,30 
,2 ,"Bilocale in via piero montagnani marelli, Quarto Oggiaro-Euromilano, Milano",650,52 
 ,2 ,"Bilocale in Greco-Villaggio dei Giornalisti, Milano",550,60 
 con ascensore,2 ,"Bilocale in piazza della repubblica, Palestro, Milano",1.250,75 
 con ascensore,3 ,"Trilocale in via amatore sciesa, Cinque Giornate-Montenero-Libia, Milano",1.270,100 
 ,2 ,"Bilocale in Bovisa, Milano",750,55 
 con ascensore,3 ,"Trilocale in Palestro, Milano",1.400,70 
 senza ascensore,,Monolocale a Abbiategrasso,350,25 
 senza ascensore,2 ,Bilocale a Abbiategrasso,475,50 
,,Monolocale a Bernate Ticino,290,35 
 con ascensore,2 ,"Bilocale in via fulvio testi, s.n.c, Cà Granda, Milano",1.180,63 
 con ascensore,2 ,"Bilocale in via teodosio, s.n.c, Teodosio-Porpora, Milano",870,65 
 con ascensore,2 ,"Bilocale in via boves, s.n.c, Udine, Milano",800,55 
,2 ,Bilocale a Arluno,550,70 
 ,2 ,Bilocale a Pantigliate,600,60 
,3 ,"Trilocale in Segrate Centro, Segrate",650,85 
,3 ,"Trilocale in Bligny-Toscana, Milano",1.500,80 
 senza ascensore,,"Monolocale in via matteotti, Parabiago",400,43 
 con ascensore,,"Monolocale in francesco sforza, Vittorio Emanuele-Augusto, Milano",920,35 
 ,3 ,Trilocale a Cernusco sul Naviglio,750,85 
 senza ascensore,2 ,"Bilocale in via isonzo, s.n.c, Bligny-Toscana, Milano",1.000,55 
,2 ,"Bilocale in via benvenuto cellini, s.n.c, Indipendenza-Regina Giovanna, Milano",1.070,40 
,2 ,"Bilocale in San Siro, Milano",650,45 
 con ascensore,2 ,"Bilocale in via giovanni pastorelli, s.n.c, Navigli-Porta Genova, Milano",1.000,70 
,,"Monolocale in via della pergola, Garibaldi-Isola, Milano",780,45 
 con ascensore,3 ,"Trilocale in San Vittore-Washington, Milano",2.000,100 
 con ascensore,,"Monolocale in via Giuseppe Garibaldi, 72, Moscova-Repubblica, Milano",950,35 
 senza ascensore,2 ,"Bilocale in Brera-Montenapoleone, Milano",1.500,60 
 ,,"Monolocale in Garibaldi-Isola, Milano",750,35 
 senza ascensore,3 ,"Trilocale in via Arturo Toscanini, 6, Senago",700,100 
,3 ,"Trilocale in via andreoli don giuseppe, 18, Bovisa, Milano",850,75 
 con ascensore,7 ,"Appartamento in Zona Sant`Ambrogio-Università Cattolica, Milano",4.550,202 
