elevator,rooms,address,price,size
 senza ascensore,3 ,"Trilocale in via domenico cimarosa, 13, San Vittore-Washington, Milano",750,75 
 con ascensore,,"Monolocale in via alfonso lamarmora, s.n.c, Tribunale, Milano",720,40 
 senza ascensore,,"Monolocale in via alfonso lamarmora, s.n.c, Tribunale, Milano",850,30 
 senza ascensore,,"Monolocale in via alfonso lamarmora, s.n.c, Tribunale, Milano",660,30 
,2 ,"Bilocale in piazza grande, 20, Trezzo sull'Adda",600,55 
,3 ,"Trilocale in via francesco de sanctis, 35, Chiesa Rossa, Milano",1.000,75 
 con ascensore,10 ,"Appartamento in via santa maria valle, s.n.c, Vetra-Missori, Milano",15.833,560 
 con ascensore,2 ,"Bilocale in via lancetti, 36, Dergano, Milano",750,60 
 con ascensore,2 ,"Bilocale in Lorenteggio-Giambellino, Milano",600,50 
 con ascensore,2 ,"Bilocale in via antonia pozzi, 5, Fiera, Milano",1.000,60 
 con ascensore,2 ,"Bilocale in piazzale arduino, 9, Fiera, Milano",1.000,75 
 con ascensore,2 ,"Bilocale in via giovanni pacini, 11, Teodosio-Porpora, Milano",1.000,78 
 con ascensore,2 ,"Bilocale in via pasquale paoli, 2, Navigli-Porta Genova, Milano",850,50 
 con ascensore,2 ,"Bilocale in via soncino, 1, Vetra-Missori, Milano",1.000,60 
 con ascensore,3 ,"Trilocale in via vespri siciliani, 20, Lorenteggio-Giambellino, Milano",900,90 
 con ascensore,4 ,"Quadrilocale in via fabio filzi, 33, Centrale, Milano",2.000,125 
 con ascensore,2 ,"Bilocale in via andrea doria, 17, Brianza-Pasteur, Milano",1.200,75 
 con ascensore,3 ,"Trilocale in via breno, 7, Brenta, Milano",900,80 
,3 ,"Trilocale in via san cristoforo, Bareggio",600,90 
 con ascensore,4 ,"Quadrilocale in via gian galeazzo, 19, Mercalli-Quadronno, Milano",1.400,100 
 con ascensore,2 ,"Bilocale in via dei tulipani, s.n.c, Lorenteggio-Giambellino, Milano",610,48 
 con ascensore,3 ,"Trilocale in via spartaco, s.n.c, Cinque Giornate-Montenero-Libia, Milano",1.465,80 
 con ascensore,3 ,"Trilocale in via antonio fogazzaro, s.n.c, Cinque Giornate-Montenero-Libia, Milano",1.110,70 
 con ascensore,2 ,"Bilocale in via lodovico il moro, s.n.c, Lodovico il Moro, Milano",800,70 
 con ascensore,,"Monolocale in via san fermo, Moscova-Repubblica, Milano",800,26 
 con ascensore,4 ,"Quadrilocale in via vincenzo bellini, s.n.c, Palestro, Milano",5.000,200 
 con ascensore,,"Monolocale in via alessandro tadino, s.n.c, Centrale, Milano",800,40 
,3 ,Trilocale a Bollate,750,90 
 con ascensore,2 ,"Bilocale in Inganni, Milano",734,62 
 ,,"Monolocale in via conte rosso, 23, Lambrate, Milano",800,59 
 con ascensore,2 ,"Bilocale in via emilio treves, 3, Udine, Milano",900,50 
 con ascensore,2 ,"Bilocale in via giulio uberti, 26, Indipendenza-Regina Giovanna, Milano",1.400,75 
 senza ascensore,2 ,"Bilocale in via cesare battisti, 50, Cologno Monzese",480,50 
 con ascensore,5 ,"Appartamento in via corsica, s.n.c, Argonne-Corsica, Milano",1.500,140 
 con ascensore,4 ,"Quadrilocale in Inganni, Milano",1.300,110 
 con ascensore,2 ,"Bilocale in via crema, Bligny-Toscana, Milano",780,50 
 senza ascensore,4 ,"Quadrilocale in piazzale dateo, 1, Indipendenza-Regina Giovanna, Milano",1.500,120 
 con ascensore,3 ,"Trilocale in corso venezia, 37, Palestro, Milano",2.780,120 
 con ascensore,3 ,"Trilocale in Moscova-Repubblica, Milano",3.500,160 
 con ascensore,3 ,"Trilocale in via aldo moro, 8, Cusago",1.150,132 
,2 ,"Bilocale in via malaga, 2, Naviglio Grande-Barona, Milano",750,65 
 con ascensore,3 ,"Trilocale in caravaggio, 2, Segrate Centro, Segrate",1.100,90 
,,"Monolocale in via cavallotti, 210, Centro, Sesto San Giovanni",550,55 
,2 ,"Bilocale in Fiera, Milano",750,70 
 con ascensore,2 ,"Bilocale in via giambellino, 41, Lorenteggio-Giambellino, Milano",870,65 
 con ascensore,2 ,"Bilocale in via papiniano, 50, Navigli-Porta Genova, Milano",1.050,55 
 con ascensore,3 ,"Trilocale in via privata umberto masotto, Argonne-Corsica, Milano",1.200,100 
,2 ,"Bilocale in via cavour, Solaro",370,35 
 con ascensore,3 ,"Trilocale in via san miniato, 10, Bicocca, Milano",700,70 
 con ascensore,3 ,"Trilocale in via salvatore pianell, 63, Cà Granda, Milano",950,90 
 con ascensore,3 ,"Trilocale in via giovanni suzzani, 287, Bicocca, Milano",400,90 
 con ascensore,2 ,"Bilocale in via soncino, 1, Vetra-Missori, Milano",1.100,55 
 con ascensore,2 ,"Attico in via soncino, 1, Vetra-Missori, Milano",1.000,50 
 con ascensore,2 ,"Bilocale in via privata ebro, 10, Vigentino, Milano",900,60 
 con ascensore,3 ,"Trilocale in piazza abbiategrasso, s.n.c, Chiesa Rossa, Milano",1.350,55 
 con ascensore,,"Monolocale in via odoardo tabacchi, 52, Bligny-Toscana, Milano",900,35 
,4 ,"Quadrilocale in via antonio tantardini, 1, Bligny-Toscana, Milano",1.300,90 
 con ascensore,4 ,"Quadrilocale in via dell'annunciata, Brera-Montenapoleone, Milano",2.600,150 
 con ascensore,2 ,"Bilocale in via galvano fiamma, 20, Indipendenza-Regina Giovanna, Milano",1.000,55 
,2 ,"Bilocale in via pace, 3, San Donato Milanese",720,45 
 con ascensore,5 ,"Appartamento in via arena, 16, Navigli-Porta Genova, Milano",2.500,180 
,,"Monolocale in via sarca, 92, Cà Granda, Milano",600,28 
 con ascensore,3 ,"Trilocale in via vigevano, 14, Navigli-Porta Genova, Milano",1.700,80 
 con ascensore,2 ,"Bilocale in via corsico, 9, Navigli-Porta Genova, Milano",1.000,52 
 con ascensore,2 ,"Bilocale in via roggia arzona, 1, Cernusco sul Naviglio",690,60 
 ,3 ,"Trilocale in via lodovico il moro, 179, Lodovico il Moro, Milano",600,100 
 con ascensore,3 ,"Trilocale in via vigevano, s.n.c, Navigli-Porta Genova, Milano",1.880,80 
 con ascensore,,"Monolocale in via carlo poma, s.n.c, Indipendenza-Regina Giovanna, Milano",750,45 
 con ascensore,5 ,"Appartamento in via timavo, Garibaldi-Isola, Milano",3.500,150 
 con ascensore,3 ,"Trilocale in via andrea solari, 15, Solari-Savona-Tortona, Milano",1.550,90 
 con ascensore,3 ,Trilocale a Bollate,750,94 
 con ascensore,2 ,"Bilocale in piazza giuseppe grandi, Martini-Cuoco, Milano",950,60 
 senza ascensore,2 ,"Bilocale in via giovanni pascoli, 43, Area Novegro-San Felice, Segrate",570,65 
 con ascensore,2 ,"Bilocale in via giovanni da cermenate, 76, Chiesa Rossa, Milano",720,55 
 senza ascensore,,"Monolocale in via tagiura, 25, Soderini, Milano",570,30 
,2 ,"Bilocale in via teodosio, 80, Teodosio-Porpora, Milano",700,45 
 con ascensore,3 ,"Trilocale in via pietro calvi, 25, Indipendenza-Regina Giovanna, Milano",1.340,80 
 ,2 ,"Bilocale in via raffaello sanzio, 17, Ariosto-Magenta, Milano",750,45 
,2 ,"Bilocale in via padova, 300, Crescenzago, Milano",800,50 
,2 ,"Bilocale in via padova, 300, Crescenzago, Milano",800,50 
,2 ,"Bilocale in via padova, 300, Crescenzago, Milano",800,50 
,3 ,"Trilocale in largo cavalieri di malta, 1, Soderini, Milano",1.000,75 
,2 ,"Bilocale in via temistocle calzecchi, 1, Città Studi, Milano",900,50 
,4 ,"Quadrilocale in via roberto tremelloni, 1, Precotto, Milano",950,140 
,4 ,"Quadrilocale in via roberto tremelloni, 2, Precotto, Milano",950,140 
,4 ,"Quadrilocale in via roberto tremelloni, 2, Precotto, Milano",950,140 
,4 ,"Quadrilocale in via roberto tremelloni, 2, Precotto, Milano",950,140 
,4 ,"Quadrilocale in via roberto tremelloni, 2, Precotto, Milano",950,140 
,4 ,"Quadrilocale in via roberto tremelloni, 2, Precotto, Milano",1.050,140 
,4 ,"Quadrilocale in via roberto tremelloni, 2, Precotto, Milano",1.050,140 
,4 ,"Quadrilocale in via roberto tremelloni, 2, Precotto, Milano",1.050,140 
,2 ,"Bilocale in via roberto tremelloni, 2, Precotto, Milano",690,60 
,2 ,"Bilocale in via roberto tremelloni, 2, Precotto, Milano",690,60 
,2 ,"Bilocale in via roberto tremelloni, 2, Precotto, Milano",690,60 
,2 ,"Bilocale in via roberto tremelloni, 2, Precotto, Milano",690,60 
,2 ,"Bilocale in via roberto tremelloni, 2, Precotto, Milano",690,60 
,2 ,"Bilocale in via roberto tremelloni, 2, Precotto, Milano",750,60 
,2 ,"Bilocale in via roberto tremelloni, 2, Precotto, Milano",750,60 
,2 ,"Bilocale in via roberto tremelloni, 2, Precotto, Milano",690,60 
,2 ,"Bilocale in via malaga, 2, Naviglio Grande-Barona, Milano",1.300,100 
,2 ,"Bilocale in via tucidide, 2, Parco Forlanini, Milano",1.150,130 
,2 ,"Bilocale in via tucidide, 2, Parco Forlanini, Milano",710,75 
,2 ,"Bilocale in via tucidide, 2, Parco Forlanini, Milano",950,120 
,2 ,"Bilocale in via tucidide, 2, Parco Forlanini, Milano",2.000,280 
,2 ,"Bilocale in via tucidide, 2, Parco Forlanini, Milano",700,65 
,,"Monolocale in via tucidide, 2, Parco Forlanini, Milano",550,65 
,2 ,"Bilocale in via tucidide, 2, Parco Forlanini, Milano",1.250,150 
,2 ,"Bilocale in via tucidide, 2, Parco Forlanini, Milano",750,65 
 senza ascensore,3 ,"Trilocale in via volvinio, 22, Chiesa Rossa, Milano",1.400,75 
 con ascensore,3 ,"Attico in via privata maria teresa, s.n.c, Zona Sant`Ambrogio-Università Cattolica, Milano",3.666,150 
,3 ,"Trilocale in via lodovico mancini, s.n.c, Indipendenza-Regina Giovanna, Milano",1.200,65 
 con ascensore,3 ,"Trilocale in via cadibona, s.n.c, Martini-Cuoco, Milano",1.200,100 
 con ascensore,2 ,"Bilocale in via alessandro volta, Moscova-Repubblica, Milano",1.300,60 
 ,,"Monolocale in via fucini, 8, Trezzano sul Naviglio",500,40 
 senza ascensore,2 ,"Bilocale in via degli imbriani, 11, Dergano, Milano",1.190,50 
 senza ascensore,2 ,"Bilocale in via premuda, Indipendenza-Regina Giovanna, Milano",800,60 
 con ascensore,6 ,"Appartamento in piazzale principessa clotilde, 8, Moscova-Repubblica, Milano",3.500,270 
,2 ,"Bilocale in via michele pericle negrotto, 42, Quarto Oggiaro-Euromilano, Milano",640,50 
 con ascensore,2 ,"Bilocale in via grigna, 5, Govone, Milano",750,50 
 con ascensore,3 ,"Trilocale in piazza armando diaz, s.n.c, Duomo-Castello, Milano",2.400,110 
 con ascensore,3 ,"Trilocale in piazzale rodolfo morandi, s.n.c, Palestro, Milano",2.300,85 
 con ascensore,,"Monolocale in piazza dei mercanti, s.n.c, Duomo-Castello, Milano",1.900,52 
 con ascensore,3 ,"Trilocale in via carlo carrà, 13, Bovisasca, Milano",1.000,90 
 con ascensore,3 ,"Trilocale in via giulio e corrado venini, 14, Brianza-Pasteur, Milano",1.400,95 
,2 ,"Bilocale in via lodovico ariosto, 24, Ariosto-Magenta, Milano",1.350,70 
 ,2 ,"Bilocale in via oderzo, 4, San Siro, Milano",700,55 
 con ascensore,2 ,"Bilocale in via vincenzo foppa, 42, San Vittore-Washington, Milano",750,60 
 con ascensore,3 ,"Trilocale in via giovanni battista morgagni, 23, Abruzzi, Milano",2.250,95 
,2 ,"Bilocale in via achille grandi, s.n.c, Sedriano",550,65 
 con ascensore,3 ,"Trilocale in via giovanni cagliero, 19, Greco-Villaggio dei Giornalisti, Milano",1.150,120 
 senza ascensore,2 ,"Bilocale in via nievo, 20, Rondò-Torretta, Sesto San Giovanni",550,65 
 con ascensore,2 ,"Bilocale in via soncino, 1, Vetra-Missori, Milano",1.000,51 
 ,2 ,"Bilocale in via arquà, 21, Teodosio-Porpora, Milano",650,55 
 con ascensore,2 ,"Bilocale in via melchiorre gioia, 74, Greco-Villaggio dei Giornalisti, Milano",700,75 
,4 ,"Quadrilocale in via eugenio torelli viollier, s.n.c, Greco-Villaggio dei Giornalisti, Milano",2.100,140 
 con ascensore,2 ,"Bilocale in via giovanni cagliero, s.n.c, Greco-Villaggio dei Giornalisti, Milano",630,60 
 con ascensore,3 ,"Trilocale in via valtellina, 18, Garibaldi-Isola, Milano",1.025,90 
 con ascensore,,"Monolocale in corso xxii marzo, 12, Cinque Giornate-Montenero-Libia, Milano",800,40 
 con ascensore,2 ,"Bilocale in corso xxii marzo, 12, Cinque Giornate-Montenero-Libia, Milano",800,50 
 senza ascensore,2 ,"Bilocale in via ciro menotti, 4, Indipendenza-Regina Giovanna, Milano",800,50 
,,"Monolocale in piazza aspromonte, 51, Romagna, Milano",600,30 
 con ascensore,3 ,"Trilocale in via guglielmo rontgen, 2, Bligny-Toscana, Milano",1.500,80 
 con ascensore,2 ,"Bilocale in via alessandro manzoni, Brera-Montenapoleone, Milano",1.500,60 
 con ascensore,2 ,"Bilocale in via desenzano, 22, Bande Nere, Milano",600,60 
,,"Monolocale in vicolo della chiesa, 10, Lainate",470,40 
 con ascensore,2 ,"Bilocale in via legioni romane, 27, Soderini, Milano",1.200,80 
 senza ascensore,2 ,"Bilocale in via achille fontanelli, 3, Comasina-Bruzzano, Milano",650,65 
,3 ,"Trilocale in via dei pellegrini, 20, Mercalli-Quadronno, Milano",1.800,100 
 con ascensore,2 ,"Bilocale in via molino delle armi, 3, Mercalli-Quadronno, Milano",950,70 
 con ascensore,,"Monolocale in via atto vannucci, Bligny-Toscana, Milano",680,40 
 con ascensore,,"Monolocale in via atto vannucci, Bligny-Toscana, Milano",700,40 
,3 ,"Trilocale in via anelli, 6, Mercalli-Quadronno, Milano",1.400,86 
 con ascensore,2 ,"Bilocale in via pasquale fornari, 20, Bande Nere, Milano",640,70 
 senza ascensore,2 ,"Bilocale in via fratelli bandiera, 202, Rondò-Torretta, Sesto San Giovanni",420,45 
 con ascensore,2 ,"Bilocale in fornari, 16, Bande Nere, Milano",660,72 
 con ascensore,2 ,"Bilocale in piazza giuseppe grandi, s.n.c, Martini-Cuoco, Milano",1.050,60 
 con ascensore,5 ,"Appartamento in via lario, s.n.c, Istria, Milano",2.000,135 
 con ascensore,,"Monolocale in piazza giuseppe missori, s.n.c, Vetra-Missori, Milano",1.100,45 
 con ascensore,4 ,"Quadrilocale in Ariosto-Magenta, Milano",2.350,170 
 con ascensore,,"Monolocale in via monza, 233, Precotto, Milano",600,35 
 con ascensore,2 ,"Bilocale in via concordia, 2, San Donato Milanese",950,75 
,,"Monolocale in via san siro, s.n.c, Cornaredo",450,40 
 con ascensore,,"Monolocale in via attilio momigliano, 2, Chiesa Rossa, Milano",500,25 
,2 ,"Bilocale in via della pace, s.n.c, Lainate",700,40 
 senza ascensore,2 ,"Appartamento su due piani in via edolo, 40, Greco-Villaggio dei Giornalisti, Milano",770,81 
 con ascensore,3 ,"Trilocale in San Magno-Sant'Ambrogio, Legnano",850,110 
 con ascensore,2 ,"Bilocale in via valparaiso, 10, Solari-Savona-Tortona, Milano",825,60 
 con ascensore,3 ,"Trilocale in via cadore, Cinque Giornate-Montenero-Libia, Milano",2.250,138 
 senza ascensore,3 ,"Trilocale in via fiori chiari, Brera-Montenapoleone, Milano",1.850,80 
 senza ascensore,2 ,"Bilocale in corso di porta romana, s.n.c, Mercalli-Quadronno, Milano",950,70 
 con ascensore,2 ,"Bilocale in via giovanola - ad.ze piazza abbiategrasso, s.n.c, Chiesa Rossa, Milano",800,65 
 con ascensore,,"Monolocale in via bari angolo via santa rita da cascia, s.n.c, Naviglio Grande-Barona, Milano",600,35 
 con ascensore,5 ,"Appartamento in via vincenzo gioberti, 5, Ariosto-Magenta, Milano",3.300,165 
 con ascensore,3 ,"Trilocale in via antonio fogazzaro, Cinque Giornate-Montenero-Libia, Milano",1.350,70 
 con ascensore,3 ,"Trilocale in via pietro mascagni, Cinisello, Cinisello Balsamo",900,110 
 con ascensore,4 ,"Quadrilocale in via gino rocca, 5, Greco-Villaggio dei Giornalisti, Milano",1.700,155 
 con ascensore,2 ,"Bilocale in via altaguardia, Bligny-Toscana, Milano",1.000,50 
 con ascensore,3 ,"Trilocale in via passo di brizio, San Siro, Milano",1.684,120 
 con ascensore,2 ,"Bilocale in via dei transiti, Brianza-Pasteur, Milano",650,63 
 con ascensore,3 ,"Trilocale in via carlo poerio, 3, Indipendenza-Regina Giovanna, Milano",1.000,70 
 con ascensore,4 ,"Quadrilocale in corso Magenta, San Vittore-Washington, Milano",2.550,160 
 con ascensore,2 ,"Bilocale in via dei transiti, Brianza-Pasteur, Milano",650,60 
,3 ,"Trilocale in via cassala, Navigli-Porta Genova, Milano",1.350,80 
 con ascensore,2 ,"Bilocale in via mario morgantini, 26, Morgantini, Milano",570,55 
,5 ,"Villa in via saragat, s.n.c, Cerro Maggiore",1.700,270 
 con ascensore,2 ,"Bilocale in piazza grandi, 4, Martini-Cuoco, Milano",1.200,65 
,2 ,"Bilocale in piazza grandi, 4, Martini-Cuoco, Milano",1.000,55 
 senza ascensore,2 ,"Appartamento su due piani in via Broletto, Duomo-Castello, Milano",2.000,80 
 con ascensore,2 ,"Bilocale in via dei Transiti, Brianza-Pasteur, Milano",800,58 
 senza ascensore,,"Monolocale in via pietro maroncelli, 7, Garibaldi-Isola, Milano",550,35 
 con ascensore,2 ,"Bilocale in galvani, Cologno Monzese",750,70 
 con ascensore,4 ,"Quadrilocale in via Ruggero di Lauria, Portello-Tre Torri, Milano",1.600,150 
 con ascensore,,"Monolocale in via daniele manin, Palestro, Milano",1.150,35 
 con ascensore,5 ,"Appartamento in via lorenzo mascheroni, s.n.c, Ariosto-Magenta, Milano",4.750,230 
 con ascensore,2 ,"Bilocale in via privata democrito, 9, Turro, Milano",750,60 
 con ascensore,3 ,"Trilocale in via giovanni paisiello, 28, Romagna, Milano",1.300,115 
 con ascensore,2 ,"Bilocale in via bartolomeo eustachi, Abruzzi, Milano",850,50 
 senza ascensore,2 ,"Bilocale in via cadore, 33, Cinque Giornate-Montenero-Libia, Milano",900,55 
,,"Monolocale in via Borgazzi Gerolamo, Mercalli-Quadronno, Milano",520,42 
,4 ,"Quadrilocale in via caduti bollatesi, Bollate",1.000,130 
 ,2 ,"Bilocale in via giuseppe garibaldi, Bollate",640,60 
,2 ,"Bilocale in via San Domenico, s.n.c, Bollate",580,60 
 con ascensore,4 ,"Quadrilocale in via cernaia, 11, Moscova-Repubblica, Milano",3.250,150 
 con ascensore,2 ,"Bilocale in via andrea costa, s.n.c, Teodosio-Porpora, Milano",1.000,75 
 senza ascensore,2 ,"Bilocale in corso buenos aires, 2, Indipendenza-Regina Giovanna, Milano",1.250,70 
,2 ,"Bilocale in via rutilia, Vigentino, Milano",600,35 
 ,2 ,"Bilocale in via san martino, s.n.c, Mercalli-Quadronno, Milano",1.300,55 
 ,,"Monolocale in via san martino, s.n.c, Mercalli-Quadronno, Milano",1.000,35 
 con ascensore,2 ,"Bilocale in plinio, s.n.c, Abruzzi, Milano",790,55 
 con ascensore,3 ,"Trilocale in via san giovanni sul muro, Zona Sant`Ambrogio-Università Cattolica, Milano",1.875,90 
 con ascensore,4 ,"Quadrilocale in via lorenzo mascheroni, Ariosto-Magenta, Milano",4.750,230 
 con ascensore,2 ,"Bilocale in via carlo giuseppe merlo, Vittorio Emanuele-Augusto, Milano",1.200,80 
 con ascensore,2 ,"Bilocale in via carlo goldoni, 84, Indipendenza-Regina Giovanna, Milano",700,45 
 senza ascensore,,"Monolocale in via ciro menotti, s.n.c, Indipendenza-Regina Giovanna, Milano",800,50 
 con ascensore,2 ,"Bilocale in via madonnina, Brera-Montenapoleone, Milano",1.700,55 
 con ascensore,2 ,"Bilocale in via l. a. muratori, Cinque Giornate-Montenero-Libia, Milano",1.000,55 
 con ascensore,4 ,"Quadrilocale in via privata del don, s.n.c, Vetra-Missori, Milano",2.050,150 
 senza ascensore,2 ,"Bilocale in via niccolò machiavelli, Ariosto-Magenta, Milano",1.300,54 
 con ascensore,4 ,"Quadrilocale in via giovanni pascoli, Città Studi, Milano",1.400,130 
 con ascensore,2 ,"Bilocale in corso di porta romana, s.n.c, Mercalli-Quadronno, Milano",1.150,88 
 con ascensore,3 ,"Trilocale in piazza eleonora duse, Palestro, Milano",4.333,200 
 con ascensore,2 ,"Bilocale in via correggio, Fiera, Milano",1.000,50 
 con ascensore,5 ,"Appartamento in monferrato, 7, San Vittore-Washington, Milano",2.000,140 
 con ascensore,2 ,"Bilocale in via vincenzo foppa, 4, San Vittore-Washington, Milano",1.042,73 
 con ascensore,3 ,"Trilocale in via angelo fumagalli, 7, Navigli-Porta Genova, Milano",1.340,100 
 ,2 ,"Bilocale in ripa di porta ticinese, 53, Navigli-Porta Genova, Milano",975,52 
 con ascensore,3 ,"Trilocale in via capo palinuro, 2, Naviglio Grande-Barona, Milano",860,80 
 senza ascensore,,"Monolocale in via pier lombardo, 2, Cinque Giornate-Montenero-Libia, Milano",600,30 
 con ascensore,2 ,"Bilocale in via ambrogio binda, 54, Naviglio Grande-Barona, Milano",1.050,85 
 senza ascensore,3 ,"Appartamento su due piani in strada alzaia naviglio grande, Lorenteggio-Giambellino, Milano",1.200,90 
 con ascensore,4 ,"Quadrilocale in via gran sasso, s.n.c, Romagna, Milano",1.650,120 
 senza ascensore,4 ,"Quadrilocale in via ciro menotti, s.n.c, Indipendenza-Regina Giovanna, Milano",1.700,110 
,2 ,"Bilocale in via Schiavoni, 2, Cermenate-Meda, Milano",700,42 
 senza ascensore,2 ,"Bilocale in via ciro menotti, s.n.c, Indipendenza-Regina Giovanna, Milano",1.250,80 
 senza ascensore,2 ,"Bilocale in piazza aspromonte, s.n.c, Romagna, Milano",800,70 
 con ascensore,3 ,"Trilocale in piazza aspromonte, s.n.c, Romagna, Milano",1.100,80 
 con ascensore,2 ,"Bilocale in piazza aspromonte, s.n.c, Romagna, Milano",1.100,80 
 con ascensore,,"Monolocale in piazza aspromonte, s.n.c, Romagna, Milano",720,50 
 con ascensore,,"Monolocale in piazza aspromonte, s.n.c, Romagna, Milano",620,35 
 con ascensore,3 ,"Trilocale in via correggio, 22, Fiera, Milano",1.200,65 
 senza ascensore,3 ,"Trilocale in via scipione pistrucci, s.n.c, Martini-Cuoco, Milano",1.100,75 
 con ascensore,3 ,"Trilocale in via antonio fogazzaro, s.n.c, Cinque Giornate-Montenero-Libia, Milano",1.318,90 
 con ascensore,2 ,"Bilocale in corso cristoforo colombo, 15, Navigli-Porta Genova, Milano",975,55 
 ,3 ,"Trilocale in via vittorio veneto, 11, Bresso",765,95 
 con ascensore,2 ,"Bilocale in via francesco cherubini, s.n.c, Ariosto-Magenta, Milano",1.580,77 
 con ascensore,2 ,"Bilocale in via alberto da giussano, Ariosto-Magenta, Milano",2.083,80 
 con ascensore,,"Monolocale in corso di porta nuova, 52, Moscova-Repubblica, Milano",800,25 
 con ascensore,2 ,"Bilocale in via Tertulliano, Cinque Giornate-Montenero-Libia, Milano",750,55 
 con ascensore,4 ,"Quadrilocale in via giuseppe frua, 9, San Vittore-Washington, Milano",2.500,160 
 ,5 ,"Appartamento in Indipendenza-Regina Giovanna, Milano",1.650,120 
 con ascensore,2 ,"Bilocale in Naviglio Grande-Barona, Milano",835,85 
,2 ,"Bilocale in via lodovico settala, 8, Palestro, Milano",850,50 
,3 ,"Trilocale in via tommaso grossi, Paderno Dugnano",600,65 
 con ascensore,7 ,"Appartamento in via vivaio, s.n.c, Palestro, Milano",2.833,180 
 con ascensore,4 ,"Quadrilocale in via francesco cherubini, Ariosto-Magenta, Milano",2.500,130 
,2 ,"Bilocale in via roma, Marcallo con Casone",550,65 
 ,2 ,"Bilocale in via riccardo pitteri, Lambrate, Milano",750,55 
 con ascensore,2 ,"Bilocale in piazza antonio gramsci, 2, Sempione, Milano",950,75 
 senza ascensore,3 ,"Trilocale in piazzale luigi cadorna, s.n.c, Ariosto-Magenta, Milano",1.970,99 
 senza ascensore,3 ,"Trilocale in via francesco nullo, s.n.c, Indipendenza-Regina Giovanna, Milano",1.300,95 
 con ascensore,4 ,"Quadrilocale in san vittore, 7, San Vittore-Washington, Milano",2.500,180 
 con ascensore,2 ,"Bilocale in via bartolomeo eustachi, Abruzzi, Milano",680,55 
 con ascensore,4 ,"Quadrilocale in via patroclo, s.n.c, San Siro, Milano",3.000,240 
 con ascensore,3 ,"Trilocale in Indipendenza-Regina Giovanna, Milano",2.100,160 
 con ascensore,,"Monolocale in via giacomo brodolini, s.n.c, Novate Milanese",550,40 
 con ascensore,5 ,"Appartamento in San Siro, Milano",2.160,240 
 con ascensore,2 ,"Bilocale in via cesare da sesto, Navigli-Porta Genova, Milano",900,60 
 con ascensore,2 ,"Bilocale in via giuseppe ungaretti, 24, Senago",400,50 
 con ascensore,2 ,"Bilocale in via bartolomeo eustachi, Abruzzi, Milano",1.250,68 
 con ascensore,3 ,"Trilocale in via privata fratelli gabba, Brera-Montenapoleone, Milano",4.250,140 
 con ascensore,,"Monolocale in via panfilo castaldi, 37, Palestro, Milano",583,46 
 con ascensore,4 ,"Quadrilocale in San Siro, Milano",1.965,130 
,5 ,"Villa in via della maggiolina, s.n.c, Greco-Villaggio dei Giornalisti, Milano",2.166,260 
 con ascensore,3 ,"Trilocale in piazzale luigi cadorna, 2, Duomo-Castello, Milano",1.970,100 
 con ascensore,4 ,"Quadrilocale in corso monforte, Palestro, Milano",2.790,170 
 con ascensore,2 ,"Bilocale in Vigentino, Milano",750,60 
 con ascensore,2 ,"Bilocale in via sebastiano del piombo, 22, Fiera, Milano",900,58 
 con ascensore,4 ,"Quadrilocale in san vittore, 7, San Vittore-Washington, Milano",2.500,180 
 con ascensore,2 ,"Bilocale in piazza grandi, s.n.c, Martini-Cuoco, Milano",1.000,62 
 con ascensore,2 ,"Bilocale in piazza grandi, s.n.c, Martini-Cuoco, Milano",1.000,62 
 con ascensore,5 ,"Appartamento in via ippolito nievo, 41, Portello-Tre Torri, Milano",3.540,180 
 con ascensore,2 ,"Bilocale in via chiossetto, Palestro, Milano",1.600,50 
 con ascensore,2 ,"Bilocale in via chiossetto, Palestro, Milano",1.600,50 
 senza ascensore,2 ,"Bilocale in piazzale luigi cadorna, s.n.c, Ariosto-Magenta, Milano",2.083,98 
 con ascensore,5 ,"Appartamento in via adeodato ressi, 21, Greco-Villaggio dei Giornalisti, Milano",1.750,175 
 con ascensore,4 ,"Quadrilocale in via giuseppe frua, 9, San Vittore-Washington, Milano",2.000,160 
 con ascensore,8 ,"Appartamento in via larga, Vittorio Emanuele-Augusto, Milano",8.165,335 
 con ascensore,2 ,"Bilocale in corso Sempione, 33, Portello-Tre Torri, Milano",1.230,90 
 con ascensore,3 ,"Trilocale in via tolstoi, s.n.c, Lorenteggio-Giambellino, Milano",1.080,95 
 senza ascensore,2 ,"Bilocale in via francesco melzi d'eril, s.n.c, Sempione, Milano",850,50 
 senza ascensore,2 ,"Bilocale in via giovanni paisiello, 3, Romagna, Milano",650,40 
 con ascensore,4 ,"Quadrilocale in corso sempione, s.n.c, Portello-Tre Torri, Milano",2.250,130 
,2 ,"Appartamento su due piani in via giacomo leopardi, 3, Ariosto-Magenta, Milano",900,40 
 con ascensore,4 ,"Quadrilocale in via cividale del friuli, 11, Bisceglie, Milano",1.000,115 
 con ascensore,2 ,"Bilocale in piazzale francesco baracca, Ariosto-Magenta, Milano",1.500,71 
,4 ,"Quadrilocale in via mortara, s.n.c, Navigli-Porta Genova, Milano",3.500,230 
,2 ,"Bilocale in via moretto da brescia, s.n.c, Città Studi, Milano",750,60 
 con ascensore,,"Monolocale in via santa teresa del bambin gesù, 93, Legnarello-Frati-Olmina, Legnano",380,35 
 con ascensore,4 ,"Attico in via quadronno, 16, Mercalli-Quadronno, Milano",3.100,160 
 con ascensore,4 ,"Quadrilocale in via giosuè carducci, 11, Zona Sant`Ambrogio-Università Cattolica, Milano",2.000,130 
 con ascensore,2 ,"Bilocale in via tolstoi, s.n.c, Lorenteggio-Giambellino, Milano",670,58 
 con ascensore,2 ,"Bilocale in via di porta vercellina, 21, San Vittore-Washington, Milano",3.000,100 
 con ascensore,4 ,"Quadrilocale in San Vittore-Washington, Milano",3.050,180 
 con ascensore,3 ,"Trilocale in via rovereto, 3, Brianza-Pasteur, Milano",1.250,108 
 con ascensore,2 ,"Bilocale in via francesco cherubini, 8, Ariosto-Magenta, Milano",1.000,50 
