elevator,rooms,address,price,size
 con ascensore,,"Monolocale in corso di porta nuova, 52, Moscova-Repubblica, Milano",680,27 
,2 ,"Bilocale in via privata catone, 29, Dergano, Milano",700,80 
 con ascensore,3 ,"Trilocale in via giuseppe garibaldi, 94, Cinisello, Cinisello Balsamo",800,88 
 con ascensore,2 ,"Bilocale in via luigi guanella, 4, Precotto, Milano",800,40 
 senza ascensore,3 ,"Trilocale in via privata galeno, 18, Precotto, Milano",950,85 
 con ascensore,2 ,"Bilocale in via beato angelico, 23, Città Studi, Milano",1.000,70 
,2 ,"Bilocale in via pavia, 8, Navigli-Porta Genova, Milano",1.100,53 
 con ascensore,2 ,"Bilocale in via giovanni paisiello, 4, Romagna, Milano",780,55 
 con ascensore,2 ,"Bilocale in via john fitzgerald kennedy, 29, San Donato Milanese",800,50 
 con ascensore,2 ,"Bilocale in via salvatore barzilai, 11, Soderini, Milano",650,75 
 senza ascensore,2 ,"Bilocale in via sebastiano del piombo, 3, Fiera, Milano",1.000,58 
 con ascensore,2 ,"Bilocale in via luigi varanini, 24, Brianza-Pasteur, Milano",730,50 
,7 ,"Casa indipendente in via pescara, 57, Gratosoglio, Milano",1.500,170 
,4 ,Villa a Magenta,1.000,150 
,,"Monolocale in pietro metastasio, 3, Ariosto-Magenta, Milano",500,18 
,2 ,Bilocale a Magenta,500,65 
 con ascensore,2 ,"Bilocale in alberto mario, 38, Fiera, Milano",1.000,60 
 con ascensore,,"Monolocale in gentilino, 11, Bligny-Toscana, Milano",680,25 
,2 ,"Bilocale in via bernardino verro, 33, Vigentino, Milano",1.150,89 
 con ascensore,3 ,Trilocale a Nerviano,630,85 
 con ascensore,,"Monolocale in via garofalo, 5, Romagna, Milano",680,30 
 senza ascensore,2 ,"Bilocale in via Maddalena Giudice Donadoni, 1, Bovisa, Milano",580,65 
 con ascensore,,"Monolocale in via pietro gobetti, 41, Garbagnate Milanese",350,44 
,8 ,"Villetta bifamiliare in via Pietro Mascagni, 4, Sedriano",1.200,250 
,2 ,"Bilocale in via anselmo ronchetti, 43, Pogliano Milanese",550,50 
 con ascensore,2 ,"Bilocale in Bligny-Toscana, Milano",950,45 
,4 ,"Villetta a schiera in via don miglietti, 2, Trezzano Rosa",1.250,200 
 con ascensore,4 ,"Quadrilocale in Indipendenza-Regina Giovanna, Milano",2.266,150 
 con ascensore,4 ,"Quadrilocale in Mercalli-Quadronno, Milano",2.500,160 
 con ascensore,2 ,"Bilocale in Istria, Milano",1.000,70 
 con ascensore,4 ,"Quadrilocale in San Vittore-Washington, Milano",3.000,170 
 con ascensore,5 ,"Appartamento in Moscova-Repubblica, Milano",2.500,190 
 con ascensore,2 ,"Bilocale in corso buenos aires, Centrale, Milano",915,55 
 con ascensore,5 ,"Appartamento in piazza vi febbraio, Portello-Tre Torri, Milano",2.330,170 
 con ascensore,2 ,"Bilocale in corso italia, Vetra-Missori, Milano",1.125,75 
 con ascensore,2 ,"Bilocale in via volterra, San Vittore-Washington, Milano",1.350,75 
 con ascensore,,"Monolocale in Argonne-Corsica, Milano",650,30 
 con ascensore,7 ,"Appartamento in corso venezia, Palestro, Milano",5.000,250 
 con ascensore,6 ,"Appartamento in via gonin, s.n.c, Lorenteggio-Giambellino, Milano",1.400,155 
,8 ,"Villa in via isonzo, s.n.c, Trezzano sul Naviglio",1.900,210 
 senza ascensore,2 ,"Bilocale in via Giovanni Rasori, 12, Ariosto-Magenta, Milano",850,55 
 con ascensore,5 ,"Appartamento in via giuseppe e francesco carlo maggiolini, Palestro, Milano",3.750,270 
 con ascensore,8 ,"Appartamento in via Solferino, Moscova-Repubblica, Milano",5.000,290 
 con ascensore,3 ,"Trilocale in san marco, 36, Moscova-Repubblica, Milano",2.085,80 
 senza ascensore,4 ,"Quadrilocale in Ariosto-Magenta, Milano",4.166,190 
 con ascensore,3 ,"Trilocale in via borgonuovo, Brera-Montenapoleone, Milano",4.000,120 
,7 ,"Casa indipendente in Dante Alighieri, Basiglio",3.750,380 
 ,2 ,"Bilocale in via santa marta, 25, Zona Sant`Ambrogio-Università Cattolica, Milano",1.750,80 
 con ascensore,6 ,"Appartamento su due piani in via dei bossi, 4, Duomo-Castello, Milano",21.000,902 
 con ascensore,2 ,"Bilocale in via rogoredo, 21, Rogoredo-Santa Giulia, Milano",800,52 
 con ascensore,2 ,"Bilocale in Inganni, Milano",950,175 
 con ascensore,3 ,"Trilocale in via dell'unione, Vetra-Missori, Milano",1.950,134 
 con ascensore,3 ,"Trilocale in via solferino, Moscova-Repubblica, Milano",2.400,100 
 con ascensore,5 ,"Appartamento in via ercole oldofredi, Garibaldi-Isola, Milano",2.700,200 
 con ascensore,4 ,"Quadrilocale in Residenza Golfo, Basiglio",1.500,125 
 con ascensore,3 ,"Trilocale in via del vecchio politecnico, s.n.c, Palestro, Milano",2.550,120 
 con ascensore,4 ,"Attico in via venti settembre, 22, Ariosto-Magenta, Milano",1.750,100 
 ,4 ,"Quadrilocale in Duomo-Castello, Milano",2.600,130 
,2 ,"Bilocale in via bruxelles, San Donato Milanese",830,90 
 senza ascensore,2 ,"Bilocale in via viii strada, 40, Area Novegro-San Felice, Segrate",700,65 
 con ascensore,4 ,"Quadrilocale in San Vittore-Washington, Milano",2.390,160 
 con ascensore,2 ,"Attico in via antonio stradivari, 1, Abruzzi, Milano",850,60 
,2 ,"Bilocale in via illirico, 1, Argonne-Corsica, Milano",630,55 
 con ascensore,2 ,"Bilocale in viale Lombardia, 22, Romagna, Milano",830,60 
 con ascensore,5 ,"Appartamento in via gran sasso, 20, Romagna, Milano",1.400,140 
 con ascensore,2 ,"Bilocale in albino, 4, Inganni, Milano",950,85 
 con ascensore,3 ,"Attico in via adolfo wildt, 19, Teodosio-Porpora, Milano",900,55 
 con ascensore,2 ,"Attico in via lambrate, 11, Teodosio-Porpora, Milano",700,60 
 con ascensore,3 ,"Trilocale in via filippo juvara, 12, Romagna, Milano",1.120,75 
,2 ,"Bilocale in via d. galli, s.n.c, Buccinasco",750,70 
 con ascensore,2 ,"Bilocale in via regina giovanna, 32, Indipendenza-Regina Giovanna, Milano",1.500,50 
 con ascensore,3 ,"Trilocale in corso monforte, Palestro, Milano",2.200,100 
 con ascensore,2 ,"Bilocale in corso concordia, Indipendenza-Regina Giovanna, Milano",1.400,60 
 con ascensore,2 ,"Bilocale in via giovanni boccaccio, 11, Ariosto-Magenta, Milano",1.450,68 
 senza ascensore,5 ,"Appartamento in via savona, Navigli-Porta Genova, Milano",3.600,230 
 con ascensore,3 ,"Trilocale in via cassanese, 170, Segrate Centro, Segrate",700,120 
 con ascensore,2 ,"Bilocale in via gian galeazzo, 2, Bligny-Toscana, Milano",980,48 
 con ascensore,3 ,"Trilocale in Vittorio Emanuele-Augusto, Milano",3.083,115 
 con ascensore,4 ,"Attico in via della spiga, 9, Brera-Montenapoleone, Milano",2.500,140 
 con ascensore,3 ,"Trilocale in via gargano, s.n.c, Val di Sole-Fatima, Milano",1.300,85 
 con ascensore,7 ,"Appartamento in via fratelli gabba, s.n.c, Brera-Montenapoleone, Milano",10.000,320 
 con ascensore,5 ,"Appartamento su due piani in via venezia, 1, Cassina de' Pecchi",1.100,180 
,,"Monolocale in via arzaga, 25, Soderini, Milano",780,40 
 con ascensore,5 ,"Appartamento in via san vincenzo, s.n.c, Navigli-Porta Genova, Milano",2.400,180 
 con ascensore,2 ,"Bilocale in via plinio, 22, Abruzzi, Milano",1.050,50 
 con ascensore,2 ,"Bilocale in via plinio, 42, Abruzzi, Milano",950,50 
 con ascensore,4 ,"Quadrilocale in via alfredo soffredini, Precotto, Milano",1.200,110 
 con ascensore,2 ,"Attico in Palestro, Milano",1.300,80 
,2 ,"Bilocale in via giuseppe garibaldi, 4, Corsico",550,55 
,2 ,"Bilocale in via san rocco, 8, Bligny-Toscana, Milano",1.000,65 
 con ascensore,2 ,"Bilocale in via dell'unione, Vetra-Missori, Milano",2.250,80 
 con ascensore,2 ,"Bilocale in via motta, San Vittore-Washington, Milano",2.000,90 
 con ascensore,2 ,"Attico in via conservatorio, Palestro, Milano",2.000,130 
,4 ,"Villetta a schiera in via Togliatti, 10, Motta Visconti",600,200 
 senza ascensore,5 ,"Appartamento su due piani in vico Santa Maria Valle, Vetra-Missori, Milano",3.750,300 
 con ascensore,3 ,"Trilocale in corso magenta, 2, Zona Sant`Ambrogio-Università Cattolica, Milano",2.580,95 
 con ascensore,5 ,"Appartamento in corso magenta, 2, Zona Sant`Ambrogio-Università Cattolica, Milano",3.417,160 
 con ascensore,5 ,"Appartamento in corso magenta, 2, Zona Sant`Ambrogio-Università Cattolica, Milano",2.792,150 
 con ascensore,,"Monolocale in via luigi settembrini, 7, Centrale, Milano",700,40 
 con ascensore,,"Monolocale in via garigliano, s.n.c, Garibaldi-Isola, Milano",800,35 
 con ascensore,3 ,"Trilocale in via saverio altamura, 8, Morgantini, Milano",1.000,100 
 con ascensore,3 ,"Trilocale in via giulio cesare procaccini, 69, Sempione, Milano",1.200,100 
,2 ,"Bilocale in via pavia, s.n.c, Navigli-Porta Genova, Milano",2.300,75 
 con ascensore,,"Monolocale in via angelo masina, 1, Dergano, Milano",550,40 
 con ascensore,2 ,"Bilocale in via sebastiano del piombo, 19, Fiera, Milano",850,60 
 con ascensore,3 ,"Trilocale in via filarete, s.n.c, Ariosto-Magenta, Milano",1.750,100 
 con ascensore,5 ,"Attico in via bigli, s.n.c, Brera-Montenapoleone, Milano",7.000,220 
 senza ascensore,4 ,Quadrilocale a Corsico,650,60 
 senza ascensore,2 ,Bilocale a Corsico,550,50 
,5 ,"Villetta a schiera in via Lombardia, 9, Cusago",2.200,225 
,,"Appartamento su due piani in via girolamo fracastoro, s.n.c, Gorla, Milano",700,46 
 con ascensore,4 ,"Quadrilocale in via carducci, 19, Zona Sant`Ambrogio-Università Cattolica, Milano",2.100,140 
 con ascensore,4 ,"Quadrilocale in san senatore, 4, Vetra-Missori, Milano",2.100,185 
 con ascensore,4 ,"Quadrilocale in via San Vittore, s.n.c, San Vittore-Washington, Milano",2.500,180 
 con ascensore,4 ,"Quadrilocale in via San Vittore, 7, San Vittore-Washington, Milano",2.500,180 
 con ascensore,5 ,"Appartamento in via bergamo, s.n.c, Cinque Giornate-Montenero-Libia, Milano",2.800,190 
 con ascensore,4 ,"Quadrilocale in via vincenzo monti, s.n.c, Ariosto-Magenta, Milano",3.666,210 
 con ascensore,5 ,"Appartamento in via lodovico ariosto, s.n.c, Ariosto-Magenta, Milano",2.666,210 
 con ascensore,4 ,"Quadrilocale in piazza della repubblica, s.n.c, Moscova-Repubblica, Milano",2.592,180 
 con ascensore,,"Monolocale in sansovino, 7, Romagna, Milano",1.100,55 
 con ascensore,3 ,"Attico in via venti settembre, 22, Ariosto-Magenta, Milano",1.750,95 
 senza ascensore,3 ,"Trilocale in via edmondo de amicis, Navigli-Porta Genova, Milano",1.250,81 
 con ascensore,6 ,"Appartamento in piazza giovanni giolitti, 8, Città Studi, Milano",2.300,200 
 con ascensore,4 ,"Quadrilocale in via fratelli zoia, Baggio, Milano",900,110 
 con ascensore,4 ,"Quadrilocale in largo oreste murani, 5, Città Studi, Milano",1.500,140 
 con ascensore,2 ,"Bilocale in via Don Monzoni, 27, Bovisa, Milano",650,45 
 con ascensore,2 ,"Bilocale in via monte rosa, s.n.c, Fiera, Milano",1.100,55 
 con ascensore,2 ,"Bilocale in via lambrate, 11, Teodosio-Porpora, Milano",665,55 
 con ascensore,2 ,"Attico in via lambrate, 11, Teodosio-Porpora, Milano",685,50 
 con ascensore,2 ,"Bilocale in via vincenzo capelli, 3, Garibaldi-Isola, Milano",2.000,65 
,2 ,"Bilocale in corso genova, 27, Navigli-Porta Genova, Milano",900,70 
 con ascensore,2 ,"Bilocale in via giovanni da cermenate, 76, Chiesa Rossa, Milano",700,65 
 con ascensore,2 ,"Bilocale in via san vittore, 13, San Vittore-Washington, Milano",1.190,65 
 con ascensore,3 ,"Trilocale in Navigli-Porta Genova, Milano",2.200,100 
,3 ,"Trilocale in corso magenta, 24, Zona Sant`Ambrogio-Università Cattolica, Milano",2.500,105 
 con ascensore,4 ,"Quadrilocale in Navigli-Porta Genova, Milano",2.500,170 
 con ascensore,4 ,"Quadrilocale in via martiri di cefalonia, 53, San Donato Milanese",1.300,150 
 con ascensore,2 ,"Attico in via luigi capuana, 56, San Carlo-San Paolo-Stellanda, Rho",650,95 
 senza ascensore,2 ,"Bilocale in via Bruno Buozzi, 6, Corsico",580,60 
,5 ,"Villetta a schiera in via Lombardia, 9, Cusago",2.200,225 
 con ascensore,6 ,"Appartamento su due piani in via giovanni mayr, 10, Palestro, Milano",5.400,290 
 senza ascensore,3 ,Trilocale a Corsico,600,55 
 con ascensore,,"Monolocale in corso magenta, 2, Zona Sant`Ambrogio-Università Cattolica, Milano",1.000,55 
 con ascensore,2 ,"Bilocale in via carlo crivelli, Mercalli-Quadronno, Milano",1.500,60 
 con ascensore,3 ,"Trilocale in via venti settembre, Ariosto-Magenta, Milano",1.750,95 
 con ascensore,3 ,"Trilocale in via mario pagano, Ariosto-Magenta, Milano",1.900,95 
 con ascensore,3 ,"Attico in via soperga, 47, Brianza-Pasteur, Milano",1.200,60 
 con ascensore,4 ,"Quadrilocale in via luigi alamanni, 13, Vigentino, Milano",1.350,110 
 con ascensore,,"Monolocale in via san gimignano, 11, Soderini, Milano",570,30 
 con ascensore,3 ,"Trilocale in largo francesco richini, Vittorio Emanuele-Augusto, Milano",2.500,115 
 con ascensore,5 ,"Appartamento su due piani in via del lauro, s.n.c, Duomo-Castello, Milano",8.000,270 
 con ascensore,4 ,"Quadrilocale in via de Amicis, s.n.c, Navigli-Porta Genova, Milano",3.500,195 
 con ascensore,3 ,"Trilocale in via Dell'Usignolo, 1, Bisceglie, Milano",1.200,76 
 con ascensore,,"Monolocale in via privata Della Torre, 36, Gorla, Milano",550,28 
 con ascensore,2 ,"Bilocale in corso di porta romana, 25, Vittorio Emanuele-Augusto, Milano",1.670,70 
 con ascensore,,"Monolocale in via privata san mansueto, 3, Bligny-Toscana, Milano",520,30 
 con ascensore,3 ,"Trilocale in via don francesco beniamino della torre, Quarto Oggiaro-Euromilano, Milano",800,120 
 con ascensore,4 ,"Quadrilocale in via luca beltrami, Duomo-Castello, Milano",3.541,190 
 con ascensore,3 ,"Trilocale in via edmondo de amicis, Navigli-Porta Genova, Milano",2.083,120 
 con ascensore,3 ,"Trilocale in via tevere, Lainate",900,100 
 con ascensore,5 ,"Appartamento in via bernardino telesio, Ariosto-Magenta, Milano",5.833,350 
 con ascensore,3 ,"Trilocale in piazza carlo caneva, Sempione, Milano",1.084,70 
 con ascensore,3 ,"Trilocale in via palermo, Moscova-Repubblica, Milano",2.500,125 
 con ascensore,4 ,"Quadrilocale in via giuseppe e francesco carlo maggiolini, Palestro, Milano",3.750,270 
 con ascensore,2 ,"Bilocale in via sannio, 24, Martini-Cuoco, Milano",900,70 
 con ascensore,7 ,"Appartamento in via alberto da giussano, Ariosto-Magenta, Milano",5.834,280 
 con ascensore,3 ,"Trilocale in via palermo, Moscova-Repubblica, Milano",1.208,95 
,3 ,"Trilocale in via martiri oscuri, 14, Brianza-Pasteur, Milano",750,90 
 con ascensore,4 ,"Quadrilocale in via giovanni pierluigi da palestrina, s.n.c, Brianza-Pasteur, Milano",1.600,140 
 con ascensore,4 ,"Quadrilocale in via gaetano donizetti, 1, Palestro, Milano",1.550,90 
 con ascensore,4 ,"Quadrilocale in via gaetano donizetti, 1, Palestro, Milano",1.750,120 
 con ascensore,3 ,"Trilocale in corso buenos aires, 5, Palestro, Milano",2.110,100 
 con ascensore,3 ,"Trilocale in via vittoria colonna, 53, Fiera, Milano",2.050,100 
 con ascensore,2 ,"Bilocale in via tito livio, Martini-Cuoco, Milano",750,60 
,3 ,"Trilocale in via antonio salieri, 4, Teodosio-Porpora, Milano",1.100,95 
 con ascensore,3 ,"Trilocale in via marghera, s.n.c, Ariosto-Magenta, Milano",2.430,100 
 con ascensore,2 ,"Bilocale in via privata degli orombelli, 7, Città Studi, Milano",650,60 
 con ascensore,8 ,"Appartamento su due piani in corso venezia, s.n.c, Palestro, Milano",10.800,408 
 con ascensore,4 ,"Attico in via fatebenefratelli, 9, Moscova-Repubblica, Milano",3.500,160 
 con ascensore,4 ,"Quadrilocale in corso sempione, s.n.c, Portello-Tre Torri, Milano",2.630,130 
 con ascensore,3 ,"Trilocale in via vigilio inama, 20, Città Studi, Milano",900,80 
 con ascensore,2 ,"Attico in via giovanni pacini, 28, Città Studi, Milano",1.050,60 
 con ascensore,5 ,"Appartamento in via bigli, 15, Brera-Montenapoleone, Milano",5.750,200 
 con ascensore,2 ,"Bilocale in via gabriele d'annunzio, 1, Navigli-Porta Genova, Milano",950,45 
 con ascensore,4 ,"Quadrilocale in via fratelli gabba, s.n.c, Brera-Montenapoleone, Milano",6.660,225 
 con ascensore,2 ,"Bilocale in via mecenate, 6, Mecenate, Milano",610,50 
 con ascensore,7 ,"Appartamento in via michelangelo buonarroti, 35, Fiera, Milano",3.334,250 
 con ascensore,2 ,"Attico in via santa maria alla porta, 9, Zona Sant`Ambrogio-Università Cattolica, Milano",2.655,93 
 con ascensore,4 ,"Attico in via Mosè Bianchi, Fiera, Milano",1.100,91 
 con ascensore,2 ,"Bilocale in via lombardia, 68, Teodosio-Porpora, Milano",850,70 
 con ascensore,2 ,"Bilocale in corso vercelli, 34, Ariosto-Magenta, Milano",1.200,70 
 con ascensore,7 ,"Attico in via iginio ugo tarchetti, 1, Moscova-Repubblica, Milano",3.000,200 
 con ascensore,3 ,"Trilocale in via venti settembre, Ariosto-Magenta, Milano",1.750,105 
 con ascensore,6 ,"Appartamento in via lorenzo mascheroni, Ariosto-Magenta, Milano",5.166,275 
 con ascensore,6 ,"Appartamento in largo quinto alpini, s.n.c, Ariosto-Magenta, Milano",3.400,255 
 con ascensore,2 ,"Bilocale in via corsica, Argonne-Corsica, Milano",840,61 
 con ascensore,3 ,"Trilocale in via ariberto, 20, Navigli-Porta Genova, Milano",2.525,120 
 con ascensore,5 ,"Appartamento in corso magenta, 60, Ariosto-Magenta, Milano",4.085,200 
 con ascensore,7 ,"Appartamento in via locatelli, s.n.c, Centrale, Milano",4.100,365 
 con ascensore,2 ,"Bilocale in via vittorio veneto, 4, Vignate",600,60 
 con ascensore,4 ,"Quadrilocale in via monte rosa, s.n.c, Fiera, Milano",2.670,155 
 con ascensore,5 ,"Appartamento in guerrazzi, Sempione, Milano",2.590,180 
 con ascensore,5 ,"Appartamento in via borgonuovo, s.n.c, Brera-Montenapoleone, Milano",5.066,190 
 con ascensore,8 ,"Appartamento su due piani in via giuseppe frua, 4, San Vittore-Washington, Milano",3.500,260 
 con ascensore,3 ,"Trilocale in via pontaccio, 19, Brera-Montenapoleone, Milano",2.700,120 
 ,3 ,"Trilocale in via annunzio cervi, 4, Bovisasca, Milano",650,112 
 con ascensore,6 ,"Appartamento in via paolo marchiondi, s.n.c, Mercalli-Quadronno, Milano",4.600,250 
 con ascensore,,"Monolocale in via Roggia Scagna, 5, Brianza-Pasteur, Milano",600,35 
,2 ,"Bilocale in via adige, 5, Mesero",500,50 
,5 ,"Appartamento su due piani in via cascina bertacca, 2, Bubbiano",935,180 
 con ascensore,2 ,"Bilocale in via luigi de andreis, s.n.c, Argonne-Corsica, Milano",750,58 
 con ascensore,5 ,"Appartamento in via luigi settembrini, s.n.c, Centrale, Milano",1.600,200 
 con ascensore,2 ,"Bilocale in vallazze, 87, Teodosio-Porpora, Milano",690,56 
 con ascensore,2 ,"Bilocale in via giuseppe canella, s.n.c, Soderini, Milano",600,50 
 con ascensore,4 ,"Quadrilocale in via alessandro stradella, 1, Abruzzi, Milano",1.650,155 
,2 ,"Bilocale in via giovanni battista morgagni, 28, Abruzzi, Milano",900,75 
 con ascensore,2 ,"Bilocale in via bartolomeo giuliano, 2, Abruzzi, Milano",1.250,50 
 con ascensore,2 ,"Bilocale in via cernaia, s.n.c, Moscova-Repubblica, Milano",2.167,90 
,,"Monolocale in via carlo poma, s.n.c, Indipendenza-Regina Giovanna, Milano",500,45 
 con ascensore,3 ,"Trilocale in piazza castello, Duomo-Castello, Milano",1.700,115 
 con ascensore,2 ,"Bilocale in piazza adigrat, s.n.c, Argonne-Corsica, Milano",1.050,75 
 senza ascensore,3 ,"Trilocale in alzaia naviglio grande, 4, Navigli-Porta Genova, Milano",1.800,100 
 con ascensore,4 ,"Quadrilocale in via francesco cherubini, 6, Ariosto-Magenta, Milano",2.500,115 
 con ascensore,3 ,"Trilocale in via caccialepori, s.n.c, Morgantini, Milano",1.000,110 
,4 ,"Quadrilocale in via ariberto, s.n.c, Navigli-Porta Genova, Milano",1.750,130 
 con ascensore,2 ,"Bilocale in via piceno 23, 23, Indipendenza-Regina Giovanna, Milano",1.200,85 
,7 ,"Casa indipendente in via Cerca, 1, Mediglia",4.400,250 
 con ascensore,,"Monolocale in via piccinni, 5, Abruzzi, Milano",800,40 
,,"Monolocale in lomazzo, Sempione, Milano",850,38 
 con ascensore,3 ,"Trilocale in via sant'orsola, Zona Sant`Ambrogio-Università Cattolica, Milano",1.500,80 
 con ascensore,2 ,"Bilocale in via caterina da forli', 58, Bande Nere, Milano",800,55 
,,"Appartamento su due piani in villoresi, Navigli-Porta Genova, Milano",1.300,68 
 con ascensore,2 ,"Bilocale in via giovanni da procida, Portello-Tre Torri, Milano",1.250,65 
 con ascensore,7 ,"Attico in via Gustavo Modena, Indipendenza-Regina Giovanna, Milano",6.000,275 
 ,2 ,"Bilocale in via francesco brioschi, Cermenate-Meda, Milano",1.100,50 
 con ascensore,,"Monolocale in via casale, Navigli-Porta Genova, Milano",500,30 
,2 ,"Bilocale in via terraggio, Zona Sant`Ambrogio-Università Cattolica, Milano",2.450,70 
 ,3 ,"Trilocale in alzaia naviglio pavese, Navigli-Porta Genova, Milano",1.150,75 
 con ascensore,3 ,"Trilocale in via giovanni spadolini, Vigentino, Milano",1.200,90 
 con ascensore,3 ,"Trilocale in piazza antonio gramsci, Sempione, Milano",2.000,130 
 con ascensore,2 ,"Bilocale in via sebastiano veniero, 12, Fiera, Milano",1.300,50 
 senza ascensore,,"Monolocale in via luigi giuseppe faravelli, Portello-Tre Torri, Milano",529,38 
,,"Monolocale in via antonio cesari, Niguarda, Milano",550,35 
 senza ascensore,2 ,"Bilocale in corso di porta ticinese, s.n.c, Mercalli-Quadronno, Milano",1.200,55 
,10 ,"Villa in via giuseppe mazzini, Segrate Centro, Segrate",2.333,550 
 con ascensore,3 ,"Trilocale in via gaetano donizetti, s.n.c, Palestro, Milano",1.650,120 
 con ascensore,4 ,"Quadrilocale in largo claudio treves, 2, Moscova-Repubblica, Milano",3.500,142 
 con ascensore,3 ,"Trilocale in via di porta vercellina, s.n.c, San Vittore-Washington, Milano",1.800,125 
 con ascensore,3 ,"Trilocale in via renato serra, 14, Fiera, Milano",1.500,80 
 senza ascensore,3 ,"Trilocale in via Delle Betulle, 32, Olmi-Muggiano, Milano",900,90 
,,"Appartamento su due piani in via Michele Pericle Negrotto, 31, Quarto Oggiaro-Euromilano, Milano",800,65 
 con ascensore,3 ,"Appartamento su due piani in via Novara, 13, San Bernardino-Ospedale Nuovo, Legnano",1.200,130 
 con ascensore,4 ,"Quadrilocale in corso di porta nuova, 48, Moscova-Repubblica, Milano",1.880,126 
 senza ascensore,2 ,"Bilocale in corso Garibaldi, s.n.c, Moscova-Repubblica, Milano",1.000,40 
 con ascensore,2 ,"Bilocale in via palermo, 5, Moscova-Repubblica, Milano",1.083,45 
 senza ascensore,2 ,"Bilocale in via solferino, 11, Moscova-Repubblica, Milano",800,34 
 con ascensore,4 ,"Quadrilocale in corso di porta nuova, 48, Moscova-Repubblica, Milano",1.710,114 
 con ascensore,2 ,"Bilocale in via soperga, s.n.c, Brianza-Pasteur, Milano",1.040,60 
 con ascensore,3 ,"Trilocale in via Caravaggio, 2, Segrate",1.100,105 
 con ascensore,,"Monolocale in via antonio stoppani, s.n.c, Abruzzi, Milano",600,25 
 con ascensore,2 ,"Bilocale in via privata raimondo montecuccoli, 4, Soderini, Milano",750,50 
 con ascensore,2 ,"Bilocale in via antonio stoppani, s.n.c, Abruzzi, Milano",900,55 
 con ascensore,3 ,"Trilocale in via san damiano, s.n.c, Palestro, Milano",2.170,116 
 con ascensore,2 ,"Bilocale in via savona, 67, Solari-Savona-Tortona, Milano",800,55 
 con ascensore,5 ,"Appartamento in via della liberazione, 15, Moscova-Repubblica, Milano",8.334,200 
 senza ascensore,3 ,Trilocale a Vittuone,600,100 
 senza ascensore,3 ,"Trilocale in via valverde, s.n.c, Trezzo sull'Adda",600,75 
,3 ,"Trilocale in via carlo ravizza, 20, Fiera, Milano",1.500,110 
 con ascensore,2 ,"Bilocale in via rogoredo, 21, Rogoredo-Santa Giulia, Milano",750,60 
 con ascensore,2 ,"Bilocale in via matteotti, 5, Carpiano",600,70 
 con ascensore,3 ,"Trilocale in via stendhal, s.n.c, Solari-Savona-Tortona, Milano",1.050,95 
 con ascensore,4 ,"Quadrilocale in via principe eugenio, 51, Govone, Milano",2.000,150 
 con ascensore,4 ,"Quadrilocale in via principe eugenio, 51, Govone, Milano",2.350,150 
,2 ,"Bilocale in via pietro custodi, 16, Bligny-Toscana, Milano",1.300,60 
 con ascensore,4 ,"Appartamento su due piani in monte rosa, 14, Fiera, Milano",2.190,170 
 con ascensore,,"Monolocale in via Sebino, 8, Martini-Cuoco, Milano",600,30 
 con ascensore,5 ,"Attico in via passo di brizio, San Siro, Milano",1.833,140 
 con ascensore,2 ,"Bilocale in via washington, 91, San Vittore-Washington, Milano",1.000,55 
 con ascensore,2 ,"Bilocale in via leoncavallo, 14, Teodosio-Porpora, Milano",750,60 
 con ascensore,5 ,"Appartamento in vincenzo monti, Ariosto-Magenta, Milano",2.000,160 
 con ascensore,3 ,"Trilocale in via della commenda, 31, Tribunale, Milano",1.800,100 
,2 ,"Bilocale in via paolo mantegazza, 5, Varesina-Testori, Milano",630,45 
 con ascensore,2 ,"Bilocale in via washington, 102, Solari-Savona-Tortona, Milano",850,50 
 con ascensore,4 ,"Quadrilocale in via marco greppi, 10, Martini-Cuoco, Milano",1.040,74 
 con ascensore,2 ,"Bilocale in via don giovanni calabria, 21, Udine, Milano",650,70 
 senza ascensore,3 ,"Trilocale in Argonne-Corsica, Milano",1.125,90 
 ,3 ,Trilocale a San Colombano al Lambro,500,85 
 con ascensore,4 ,"Quadrilocale in via nerino, Zona Sant`Ambrogio-Università Cattolica, Milano",4.200,150 
,3 ,Trilocale a San Colombano al Lambro,550,110 
,2 ,"Bilocale in via lodovico ariosto, Ariosto-Magenta, Milano",1.333,75 
 senza ascensore,2 ,"Bilocale in via paolo sarpi, s.n.c, Sempione, Milano",930,45 
,3 ,"Trilocale in alberto mario, s.n.c, Fiera, Milano",1.300,120 
 con ascensore,4 ,"Quadrilocale in via piceno, s.n.c, Indipendenza-Regina Giovanna, Milano",2.450,180 
 con ascensore,2 ,"Bilocale in via vallazze, 93, Teodosio-Porpora, Milano",630,55 
 con ascensore,2 ,"Bilocale in piazzale brescia, s.n.c, Morgantini, Milano",1.000,70 
,,"Monolocale in via privata martiri triestini, 10, Morgantini, Milano",580,30 
,,"Monolocale in via murillo, 33, Morgantini, Milano",500,30 
 con ascensore,5 ,"Appartamento in via gerolamo borgazzi, s.n.c, Mercalli-Quadronno, Milano",2.250,155 
 con ascensore,2 ,"Bilocale in via vitruvio, 47, Centrale, Milano",950,68 
 con ascensore,3 ,"Trilocale in rosselli, 25, Sulmona, Milano",700,75 
,3 ,"Trilocale in via torquato tasso, 14, Rondinella-Baraggia-Restellone, Sesto San Giovanni",850,85 
 con ascensore,3 ,"Trilocale in corso di porta romana, Tribunale, Milano",2.000,100 
,3 ,"Appartamento su due piani in via Venino, 21, Settimo Milanese",1.400,107 
 senza ascensore,3 ,"Appartamento su due piani in via Venino, 21, Settimo Milanese",1.000,104 
 senza ascensore,3 ,"Appartamento su due piani in via Venino, 21, Settimo Milanese",1.300,142 
 senza ascensore,2 ,"Appartamento su due piani in via Venino, 21, Settimo Milanese",700,89 
